Rank,English_Title,URL,Directors,Writers,Stars
129,Per qualche dollaro in più,https://www.imdb.com/title/tt0059578/?ref_=chttp_t_129,Sergio Leone,"Sergio Leone, Fulvio Morsella, Luciano Vincenzoni","Clint Eastwood, Lee Van Cleef, Gian Maria Volontè, Mara Krupp, Luigi Pistilli, Klaus Kinski, Luis Rodríguez, Benito Stefanelli, Panos Papadopulos, Aldo Sambrell, Roberto Camardiel, Joseph Egger, Tomás Blanco, Lorenzo Robledo, Dante Maggio, Sergio Mendizábal, Diana Rabito, Giovanni Tarallo"
130,Batman Begins,https://www.imdb.com/title/tt0372784/?ref_=chttp_t_130,Christopher Nolan,"Bob Kane, David S. Goyer, Christopher Nolan","Christian Bale, Michael Caine, Ken Watanabe, Liam Neeson, Katie Holmes, Gary Oldman, Cillian Murphy, Tom Wilkinson, Rutger Hauer, Linus Roache, Mark Boone Junior, Morgan Freeman, Larry Holden, Gerard Murphy, Colin McFarlane, Sara Stewart, Gus Lewis, Richard Brake"
131,The Wolf of Wall Street,https://www.imdb.com/title/tt0993846/?ref_=chttp_t_131,Martin Scorsese,"Terence Winter, Jordan Belfort","Leonardo DiCaprio, Jonah Hill, Margot Robbie, Matthew McConaughey, Kyle Chandler, Rob Reiner, Jon Bernthal, Jon Favreau, Jean Dujardin, Joanna Lumley, Cristin Milioti, Christine Ebersole, Shea Whigham, Katarina Cas, P.J. Byrne, Kenneth Choi, Brian Sacca, Henry Zebrowski"
132,Some Like It Hot,https://www.imdb.com/title/tt0053291/?ref_=chttp_t_132,Billy Wilder,"Billy Wilder, I.A.L. Diamond, Robert Thoeren","Marilyn Monroe, Tony Curtis, Jack Lemmon, George Raft, ""Pat OBrien"", Joe E. Brown, Nehemiah Persoff, Joan Shawlee, Billy Gray, George E. Stone, Dave Barry, Mike Mazurki, Harry Wilson, Beverly Wills, Barbara Drew, Edward G. Robinson Jr., Sam Bagley, Brandon Beach"
133,The Kid,https://www.imdb.com/title/tt0012349/?ref_=chttp_t_133,Charles Chaplin,Charles Chaplin,"Charles Chaplin, Edna Purviance, Jackie Coogan, Carl Miller, Albert Austin, Beulah Bains, Nellie Bly Baker, Henry Bergman, Edward Biby, B.F. Blinn, Kitty Bradbury, Frank Campeau, Bliss Chevalier, Frances Cochran, Elsie Codd, Jack Coogan Sr., Estelle Cook, Lillian Crane"
134,Green Book,https://www.imdb.com/title/tt6966692/?ref_=chttp_t_134,Peter Farrelly,"Nick Vallelonga, Brian Hayes Currie, Peter Farrelly","Viggo Mortensen, Mahershala Ali, Linda Cardellini, Sebastian Maniscalco, Dimiter D. Marinov, Mike Hatton, P.J. Byrne, Joe Cortese, Mary Agnes Nixon, Von Lewis, Jon Sortland, Don Stark, Anthony Mangano, Paul Sloan, Quinn Duffy, Seth Hurwitz, Hudson Galloway, Gavin Lyle Foley"
135,The Father,https://www.imdb.com/title/tt10272386/?ref_=chttp_t_135,Florian Zeller,"Christopher Hampton, Florian Zeller","Anthony Hopkins, Olivia Colman, Mark Gatiss, Olivia Williams, Imogen Poots, Rufus Sewell, Ayesha Dharker, Roman Zeller, Adnan Kundi, Brian Rodger, Evie Wray"
136,Judgment at Nuremberg,https://www.imdb.com/title/tt0055031/?ref_=chttp_t_136,Stanley Kramer,"Abby Mann, Montgomery Clift","Spencer Tracy, Burt Lancaster, Richard Widmark, Marlene Dietrich, Maximilian Schell, Judy Garland, Montgomery Clift, William Shatner, Werner Klemperer, Kenneth MacKenna, Torben Meyer, Joseph Bernard, Alan Baxter, Edward Binns, Virginia Christine, Otto Waldis, Karl Swenson, Martin Brandt"
137,All About Eve,https://www.imdb.com/title/tt0042192/?ref_=chttp_t_137,Joseph L. Mankiewicz,"Joseph L. Mankiewicz, Mary Orr","Bette Davis, Anne Baxter, George Sanders, Celeste Holm, Gary Merrill, Hugh Marlowe, Gregory Ratoff, Barbara Bates, Marilyn Monroe, Thelma Ritter, Walter Hampden, Randy Stuart, Craig Hill, Leland Harris, Barbara White, Eddie Fisher, William Pullen, Claude Stroud"
138,The Truman Show,https://www.imdb.com/title/tt0120382/?ref_=chttp_t_138,Peter Weir,Andrew Niccol,"Jim Carrey, Ed Harris, Laura Linney, Noah Emmerich, Natascha McElhone, Holland Taylor, Brian Delate, Blair Slater, Peter Krause, Heidi Schanz, Ron Taylor, Don Taylor, Ted Raymond, Judy Clayton, Fritz Dominique, Angel Schmiedt, Nastassja Schmiedt, Muriel Moore"
139,Top Gun: Maverick,https://www.imdb.com/title/tt1745960/?ref_=chttp_t_139,Joseph Kosinski,"Jim Cash, Jack Epps Jr., Peter Craig","Tom Cruise, Jennifer Connelly, Miles Teller, Val Kilmer, Bashir Salahuddin, Jon Hamm, Charles Parnell, Monica Barbaro, Lewis Pullman, Jay Ellis, Danny Ramirez, Glen Powell, Jack Schumacher, Manny Jacinto, Kara Wang, Greg Tarzan Davis, Jake Picking, Raymond Lee"
140,Shutter Island,https://www.imdb.com/title/tt1130884/?ref_=chttp_t_140,Martin Scorsese,"Laeta Kalogridis, Dennis Lehane","Leonardo DiCaprio, Emily Mortimer, Mark Ruffalo, Ben Kingsley, Max von Sydow, Michelle Williams, Patricia Clarkson, Jackie Earle Haley, Ted Levine, John Carroll Lynch, Elias Koteas, Robin Bartlett, Christopher Denham, Nellie Sciutto, Joseph Sikora, Curtiss Cook, Raymond Anthony Thomas, Joseph McKenna"
141,There Will Be Blood,https://www.imdb.com/title/tt0469494/?ref_=chttp_t_141,Paul Thomas Anderson,"Paul Thomas Anderson, Upton Sinclair","Daniel Day-Lewis, Paul Dano, Ciarán Hinds, Martin Stringer, Matthew Braden Stringer, Jacob Stringer, Joseph Mussey, Barry Del Sherman, Harrison Taylor, Stockton Taylor, Paul F. Tompkins, Dillon Freasier, Kevin Breznahan, Jim Meskimen, Erica Sullivan, Randall Carver, Coco Leigh, Sydney McCallister"
142,Casino,https://www.imdb.com/title/tt0112641/?ref_=chttp_t_142,Martin Scorsese,"Nicholas Pileggi, Martin Scorsese","Robert De Niro, Sharon Stone, Joe Pesci, James Woods, Don Rickles, Alan King, Kevin Pollak, L.Q. Jones, Dick Smothers, Frank Vincent, John Bloom, Pasquale Cajano, Melissa Prophet, Bill Allison, Vinny Vella, Philip Suriano, Erika von Tagen, Frankie Avalon"
143,Ran,https://www.imdb.com/title/tt0089881/?ref_=chttp_t_143,Akira Kurosawa,"Akira Kurosawa, Hideo Oguni, Masato Ide","Tatsuya Nakadai, Akira Terao, Jinpachi Nezu, Daisuke Ryû, Mieko Harada, Yoshiko Miyazaki, Hisashi Igawa, Pîtâ, Masayuki Yui, Kazuo Katô, Norio Matsui, Toshiya Ito, Kenji Kodama, Takashi Watanabe, Mansai Nomura, Takeshi Katô, Jun Tazaki, Hitoshi Ueki"
144,Jurassic Park,https://www.imdb.com/title/tt0107290/?ref_=chttp_t_144,Steven Spielberg,"Michael Crichton, David Koepp","Sam Neill, Laura Dern, Jeff Goldblum, Richard Attenborough, Bob Peck, Martin Ferrero, BD Wong, Joseph Mazzello, Ariana Richards, Samuel L. Jackson, Wayne Knight, Gerald R. Molen, Miguel Sandoval, Cameron Thor, Christopher John Fields, Whit Hertford, Dean Cundey, Jophery C. Brown"
145,The Sixth Sense,https://www.imdb.com/title/tt0167404/?ref_=chttp_t_145,M. Night Shyamalan,M. Night Shyamalan,"Bruce Willis, Haley Joel Osment, Toni Collette, Olivia Williams, Trevor Morgan, Donnie Wahlberg, Peter Anthony Tambakis, Jeffrey Zubernis, Bruce Norris, Glenn Fitzgerald, Greg Wood, Mischa Barton, Angelica Page, Lisa Summerour, Firdous Bamji, Samia Shoaib, Hayden Saunier, Janis Dardaris"
146,El laberinto del fauno,https://www.imdb.com/title/tt0457430/?ref_=chttp_t_146,Guillermo del Toro,Guillermo del Toro,"Ivana Baquero, Ariadna Gil, Sergi López, Maribel Verdú, Doug Jones, Álex Angulo, Manolo Solo, César Vea, Roger Casamajor, Ivan Massagué, Gonzalo Uriarte, Eusebio Lázaro, Francisco Vidal, Juanjo Cucalón, Lina Mira, Mario Zorrilla, Sebastián Haro, Mila Espiga"
147,Unforgiven,https://www.imdb.com/title/tt0105695/?ref_=chttp_t_147,Clint Eastwood,David Webb Peoples,"Clint Eastwood, Gene Hackman, Morgan Freeman, Richard Harris, Jaimz Woolvett, Saul Rubinek, Frances Fisher, Anna Thomson, David Mucci, Rob Campbell, Anthony James, Tara Frederick, Beverley Elliott, Liisa Repo-Martell, Josie Smith, Shane Meier, Aline Levasseur, Cherrilene Cardinal"
148,No Country for Old Men,https://www.imdb.com/title/tt0477348/?ref_=chttp_t_148,"Ethan Coen, Joel Coen","Joel Coen, Ethan Coen, Cormac McCarthy","Tommy Lee Jones, Javier Bardem, Josh Brolin, Woody Harrelson, Kelly Macdonald, Garret Dillahunt, Tess Harper, Barry Corbin, Stephen Root, Rodger Boyce, Beth Grant, Ana Reeder, Kit Gwin, Zach Hopkins, Chip Love, Eduardo Antonio Garcia, Gene Jones, Myk Watford"
149,A Beautiful Mind,https://www.imdb.com/title/tt0268978/?ref_=chttp_t_149,Ron Howard,"Akiva Goldsman, Sylvia Nasar","Russell Crowe, Ed Harris, Jennifer Connelly, Christopher Plummer, Paul Bettany, Adam Goldberg, Josh Lucas, Anthony Rapp, Jason Gray-Stanford, Judd Hirsch, Austin Pendleton, Vivien Cardone, Jillie Simon, Victor Steinbach, Tanya Clarke, Thomas F. Walsh, Jesse Doran, Kent Cassella"
150,The Thing,https://www.imdb.com/title/tt0084787/?ref_=chttp_t_150,John Carpenter,"Bill Lancaster, John W. Campbell Jr.","Kurt Russell, Wilford Brimley, Keith David, Richard Masur, T.K. Carter, David Clennon, Richard Dysart, Charles Hallahan, Peter Maloney, Donald Moffat, Joel Polis, Thomas G. Waites, Norbert Weisser, Larry Franco, Nate Irwin, William Zeman, Adrienne Barbeau, John Carpenter"
151,The Treasure of the Sierra Madre,https://www.imdb.com/title/tt0040897/?ref_=chttp_t_151,John Huston,"John Huston, B. Traven","Humphrey Bogart, Walter Huston, Tim Holt, Bruce Bennett, Barton MacLane, Alfonso Bedoya, Arturo Soto Rangel, Manuel Dondé, José Torvay, Margarito Luna, Robert Blake, Guillermo Calles, Roberto Cañedo, Spencer Chan, Jacqueline Dalya, Ralph Dunn, Ernesto Escoto, Pat Flaherty"
152,Kill Bill: Vol. 1,https://www.imdb.com/title/tt0266697/?ref_=chttp_t_152,Quentin Tarantino,"Quentin Tarantino, Uma Thurman","Uma Thurman, David Carradine, Daryl Hannah, Michael Madsen, Lucy Liu, Vivica A. Fox, Julie Dreyfus, Chiaki Kuriyama, ""Shinichi Chiba"", Chia-Hui Liu, Michael Parks, Michael Bowen, Jun Kunimura, Kenji Ôba, Yuki Kazamatsuri, James Parks, Sakichi Sato, Jonathan Loughran"
153,Yôjinbô,https://www.imdb.com/title/tt0055630/?ref_=chttp_t_153,Akira Kurosawa,"Akira Kurosawa, Ryûzô Kikushima","Toshirô Mifune, Eijirô Tôno, Tatsuya Nakadai, Yôko Tsukasa, Isuzu Yamada, Daisuke Katô, Seizaburô Kawazu, Takashi Shimura, Hiroshi Tachikawa, Yôsuke Natsuki, Kamatari Fujiwara, Ikio Sawamura, Atsushi Watanabe, Susumu Fujita, Kyû Sazanka, Kô Nishimura, Takeshi Katô, Ichirô Nakatani"
154,Monty Python and the Holy Grail,https://www.imdb.com/title/tt0071853/?ref_=chttp_t_154,"Terry Gilliam, Terry Jones","Graham Chapman, John Cleese, Eric Idle","Graham Chapman, John Cleese, Eric Idle, Terry Gilliam, Terry Jones, Michael Palin, Connie Booth, Carol Cleveland, Neil Innes, Bee Duffell, John Young, Rita Davies, Avril Stewart, Sally Kinghorn, Mark Zycon, Elspeth Cameron, Mitsuko Forstater, Sandy Johnson"
155,The Great Escape,https://www.imdb.com/title/tt0057115/?ref_=chttp_t_155,John Sturges,"Paul Brickhill, James Clavell, W.R. Burnett","Steve McQueen, James Garner, Richard Attenborough, Charles Bronson, James Donald, Donald Pleasence, James Coburn, Hannes Messemer, David McCallum, Gordon Jackson, John Leyton, Angus Lennie, Nigel Stock, Robert Graf, Jud Taylor, Hans Reiser, Harry Riebauer, William Russell"
156,Finding Nemo,https://www.imdb.com/title/tt0266543/?ref_=chttp_t_156,"Andrew Stanton, Lee Unkrich","Andrew Stanton, Bob Peterson, David Reynolds","Albert Brooks, Ellen DeGeneres, Alexander Gould, Willem Dafoe, Brad Garrett, Allison Janney, Austin Pendleton, Stephen Root, Vicki Lewis, Joe Ranft, Geoffrey Rush, Andrew Stanton, Elizabeth Perkins, Nicholas Bird, Bob Peterson, Barry Humphries, Eric Bana, Bruce Spence"
157,Rashômon,https://www.imdb.com/title/tt0042876/?ref_=chttp_t_157,Akira Kurosawa,"Ryûnosuke Akutagawa, Akira Kurosawa, Shinobu Hashimoto","Toshirô Mifune, Machiko Kyô, Masayuki Mori, Takashi Shimura, Minoru Chiaki, Kichijirô Ueda, Noriko Honma, Daisuke Katô"
158,Prisoners,https://www.imdb.com/title/tt1392214/?ref_=chttp_t_158,Denis Villeneuve,Aaron Guzikowski,"Hugh Jackman, Jake Gyllenhaal, Viola Davis, Melissa Leo, Maria Bello, Terrence Howard, Paul Dano, Dylan Minnette, Zoë Soul, Erin Gerasimovich, Kyla-Drew, Wayne Duvall, Len Cariou, David Dastmalchian, Brad James, Anthony Reynolds, Robert C. Treveiler, Sandra Ellis Lafferty"
159,Hauru no ugoku shiro,https://www.imdb.com/title/tt0347149/?ref_=chttp_t_159,Hayao Miyazaki,"Hayao Miyazaki, Diana Wynne Jones","Chieko Baishô, Takuya Kimura, Tatsuya Gashûin, Akihiro Miwa, Ryunosuke Kamiki, Mitsunori Isaki, Yô Ôizumi, Akio Ôtsuka, Daijirô Harada, Haruko Katô, Jean Simmons, Christian Bale, Lauren Bacall, Blythe Danner, Emily Mortimer, Josh Hutcherson, Billy Crystal, Jena Malone"
160,The Elephant Man,https://www.imdb.com/title/tt0080678/?ref_=chttp_t_160,David Lynch,"Christopher De Vore, Eric Bergren, David Lynch","Anthony Hopkins, John Hurt, Anne Bancroft, John Gielgud, Wendy Hiller, Freddie Jones, Michael Elphick, Hannah Gordon, Helen Ryan, John Standing, Dexter Fletcher, Lesley Dunlop, Phoebe Nicholls, Pat Gorman, Claire Davenport, Orla Pederson, Patsy Smart, Frederick Treves"
161,Chinatown,https://www.imdb.com/title/tt0071315/?ref_=chttp_t_161,Roman Polanski,"Robert Towne, Roman Polanski","Jack Nicholson, Faye Dunaway, John Huston, Perry Lopez, John Hillerman, Darrell Zwerling, Diane Ladd, Roy Jenson, Roman Polanski, Richard Bakalyan, Joe Mantell, Bruce Glover, Nandu Hinds, ""James ORear"", James Hong, Beulah Quo, Jerry Fujikawa, Belinda Palmer"
162,Dial M for Murder,https://www.imdb.com/title/tt0046912/?ref_=chttp_t_162,Alfred Hitchcock,Frederick Knott,"Ray Milland, Grace Kelly, Robert Cummings, John Williams, Anthony Dawson, Leo Britt, Patrick Allen, George Leigh, George Alderson, Robin Hughes, Richard Bender, Robin Sanders Clark, Jack Cunningham, Robert Dobson, Guy Doleman, Bess Flowers, Robert Garvin, Herschel Graham"
163,Gone with the Wind,https://www.imdb.com/title/tt0031381/?ref_=chttp_t_163,"Victor Fleming, George Cukor, Sam Wood","Margaret Mitchell, Sidney Howard, Oliver H.P. Garrett","Clark Gable, Vivien Leigh, Thomas Mitchell, ""Barbara ONeil"", Evelyn Keyes, Ann Rutherford, George Reeves, Fred Crane, Hattie McDaniel, Oscar Polk, Butterfly McQueen, Victor Jory, Everett Brown, Howard Hickman, Alicia Rhett, Leslie Howard, Olivia de Havilland, Rand Brooks"
164,V for Vendetta,https://www.imdb.com/title/tt0434409/?ref_=chttp_t_164,James McTeigue,"Lilly Wachowski, Lana Wachowski, David Lloyd","Hugo Weaving, Natalie Portman, Rupert Graves, Stephen Rea, Stephen Fry, John Hurt, Tim Pigott-Smith, Roger Allam, Ben Miles, Sinéad Cusack, Natasha Wightman, John Standing, Eddie Marsan, Clive Ashborn, Emma Field-Rayner, Ian Burfield, Mark Phoenix, Alister Mazzotti"
165,"Lock, Stock and Two Smoking Barrels",https://www.imdb.com/title/tt0120735/?ref_=chttp_t_165,Guy Ritchie,Guy Ritchie,"Jason Flemyng, Dexter Fletcher, Nick Moran, Jason Statham, Steven Mackintosh, Nicholas Rowe, Nick Marcq, Charles Forbes, Vinnie Jones, Lenny McLean, Peter McNicholl, P.H. Moriarty, Frank Harper, Steve Sweeney, Huggy Leaver, Ronnie Fox, Tony McMahon, Stephen Marcus"
166,El secreto de sus ojos,https://www.imdb.com/title/tt1305806/?ref_=chttp_t_166,Juan José Campanella,"Eduardo Sacheri, Juan José Campanella","Ricardo Darín, Soledad Villamil, Pablo Rago, Carla Quevedo, Javier Godino, Bárbara Palladino, Rudy Romano, Alejandro Abelenda, Mario Alarcón, Guillermo Francella, Sebastián Blanco, Mariano Argento, José Luis Gioia, Juan José Ortíz, Kiko Cerone, Fernando Pardo, Maximiliano Trento, Sergio Santana"
167,Inside Out,https://www.imdb.com/title/tt2096673/?ref_=chttp_t_167,"Pete Docter, Ronnie Del Carmen","Pete Docter, Ronnie Del Carmen, Meg LeFauve","Amy Poehler, Bill Hader, Lewis Black, Mindy Kaling, Phyllis Smith, Richard Kind, Kaitlyn Dias, Diane Lane, Kyle MacLachlan, Paula Poundstone, Bobby Moynihan, Paula Pell, Dave Goelz, Frank Oz, Josh Cooley, Flea, John Ratzenberger, Carlos Alazraqui"
168,Raging Bull,https://www.imdb.com/title/tt0081398/?ref_=chttp_t_168,Martin Scorsese,"Jake LaMotta, Joseph Carter, Peter Savage","Robert De Niro, Cathy Moriarty, Joe Pesci, Frank Vincent, Nicholas Colasanto, Theresa Saldana, Mario Gallo, Frank Adonis, Joseph Bono, Frank Topham, Lori Anne Flax, Charles Scorsese, Don Dunphy, Bill Hanrahan, Rita Bennett, James V. Christy, Bernie Allen, Floyd Anderson"
169,"Three Billboards Outside Ebbing, Missouri",https://www.imdb.com/title/tt5027774/?ref_=chttp_t_169,Martin McDonagh,Martin McDonagh,"Frances McDormand, Woody Harrelson, Sam Rockwell, Caleb Landry Jones, Kerry Condon, Alejandro Barrios, Clarke Peters, Darrell Britt-Gibson, Abbie Cornish, Riya May Atwood, Selah Atwood, Lucas Hedges, Zeljko Ivanek, Amanda Warren, Malaya Rivera Drew, Sandy Martin, Peter Dinklage, Christopher Berry"
170,Trainspotting,https://www.imdb.com/title/tt0117951/?ref_=chttp_t_170,Danny Boyle,"Irvine Welsh, John Hodge","Ewan McGregor, Ewen Bremner, Jonny Lee Miller, Kevin McKidd, Robert Carlyle, Kelly Macdonald, Peter Mullan, James Cosmo, Eileen Nicholas, Susan Vidler, Pauline Lynch, Shirley Henderson, Stuart McQuarrie, Irvine Welsh, Dale Winton, Keith Allen, Kevin Allen, Annie Louise Ross"
171,The Bridge on the River Kwai,https://www.imdb.com/title/tt0050212/?ref_=chttp_t_171,David Lean,"Pierre Boulle, Carl Foreman, Michael Wilson","William Holden, Alec Guinness, Jack Hawkins, Sessue Hayakawa, James Donald, Geoffrey Horne, André Morell, Peter Williams, John Boxer, Percy Herbert, Harold Goodwin, Ann Sears, Heihachirô Ôkawa, Keiichirô Katsumoto, M.R.B. Chakrabandhu, Vilaiwan Seeboonreaung, Ngamta Suphaphongs, Javanart Punynchoti"
172,Spider-Man: No Way Home,https://www.imdb.com/title/tt10872600/?ref_=chttp_t_172,Jon Watts,"Chris McKenna, Erik Sommers, Stan Lee","Tom Holland, Zendaya, Benedict Cumberbatch, Jacob Batalon, Jon Favreau, Jamie Foxx, Willem Dafoe, Alfred Molina, Benedict Wong, Tony Revolori, Marisa Tomei, Andrew Garfield, Tobey Maguire, Angourie Rice, Arian Moayed, Paula Newsome, Hannibal Buress, Martin Starr"
173,Fargo,https://www.imdb.com/title/tt0116282/?ref_=chttp_t_173,"Joel Coen, Ethan Coen","Ethan Coen, Joel Coen","William H. Macy, Frances McDormand, Steve Buscemi, Peter Stormare, Kristin Rudrüd, Harve Presnell, Tony Denman, Gary Houston, Sally Wingert, Kurt Schweickhardt, Larissa Kokernot, Melissa Peterman, Steve Reevis, Warren Keith, Steve Edelman, Sharon Anderson, Larry Brandenburg, James Gaulke"
174,Klaus,https://www.imdb.com/title/tt4729430/?ref_=chttp_t_174,"Sergio Pablos, Carlos Martínez López","Sergio Pablos, Jim Mahoney, Zach Lewis","Jason Schwartzman, J.K. Simmons, Rashida Jones, Will Sasso, Neda Margrethe Labba, Sergio Pablos, Norm MacDonald, Joan Cusack, Evan Agos, Sky Alexis, Jaeden Bettencourt, Teddy Blum, Mila Brener, Sydney Brower, Finn Carr, Kendall Joy Hall, Hailey Hermida, Lexie Holland"
175,Warrior,https://www.imdb.com/title/tt1291584/?ref_=chttp_t_175,"""Gavin OConnor""","""Gavin OConnor"", Anthony Tambakis, Cliff Dorfman","Tom Hardy, Nick Nolte, Joel Edgerton, Jennifer Morrison, Frank Grillo, Kevin Dunn, Maximiliano Hernández, Bryan Callen, Sam Sheridan, Fernando Chien, Jake McLaughlin, Vanessa Martinez, Denzel Whitaker, Carlos Miranda, Nick Lehane, Laura Chinn, Capri Thomas, Lexi Cowan"
176,Catch Me If You Can,https://www.imdb.com/title/tt0264464/?ref_=chttp_t_176,Steven Spielberg,"Frank Abagnale Jr., Stan Redding, Jeff Nathanson","Leonardo DiCaprio, Tom Hanks, Christopher Walken, Martin Sheen, Nathalie Baye, Amy Adams, James Brolin, Brian Howe, Frank John Hughes, Steve Eastin, Chris Ellis, John Finn, Jennifer Garner, Nancy Lenehan, Ellen Pompeo, Elizabeth Banks, Guy Thauvette, Candice Azzara"
177,Gojira -1.0,https://www.imdb.com/title/tt23289160/?ref_=chttp_t_177,Takashi Yamazaki,"Ishirô Honda, Takeo Murata, Takashi Yamazaki","Minami Hamabe, Sakura Andô, Ryunosuke Kamiki, Rikako Miura, Yuki Yamada, Munetaka Aoki, Takato Yonemoto, Michael Arias, Yuki Takao, Kuranosuke Sasaki, Hidetaka Yoshioka, Saori, Yûya Endô, Kisuke Iida, Miou Tanaka, Sae Nagatani, Jun Saito, Ozuno Nakamura"
178,Gran Torino,https://www.imdb.com/title/tt1205489/?ref_=chttp_t_178,Clint Eastwood,"Nick Schenk, Dave Johannson","Clint Eastwood, Bee Vang, Christopher Carley, Ahney Her, Brian Haley, Geraldine Hughes, Dreama Walker, Brian Howe, John Carroll Lynch, William Hill, Brooke Chia Thao, Chee Thao, Choua Kue, Scott Eastwood, Xia Soua Chang, Sonny Vue, Doua Moua, Greg Trzaskoma"
179,Tonari no Totoro,https://www.imdb.com/title/tt0096283/?ref_=chttp_t_179,Hayao Miyazaki,Hayao Miyazaki,"Hitoshi Takagi, Noriko Hidaka, Chika Sakamoto, Shigesato Itoi, Sumi Shimamoto, Tanie Kitabayashi, Hiroko Maruyama, Machiko Washio, Reiko Suzuki, Masashi Hirose, Toshiyuki Amagasa, Shigeru Chiba, Naoki Tatsuta, Tarako, Tomohiro Nishimura, Mitsuko Ishida, Chie Kôjiro, Daiki Nakamura"
180,Million Dollar Baby,https://www.imdb.com/title/tt0405159/?ref_=chttp_t_180,Clint Eastwood,"Paul Haggis, F.X. Toole","Hilary Swank, Clint Eastwood, Morgan Freeman, Jay Baruchel, Mike Colter, Lucia Rijker, ""Brían F. OByrne"", Anthony Mackie, Margo Martindale, Riki Lindhome, Michael Peña, Benito Martinez, Bruce MacVittie, David Powledge, ""Joe DAngerio"", Marcus Chait, Tom McCleister, Erica Grant"
181,Harry Potter and the Deathly Hallows - Part 2,https://www.imdb.com/title/tt1201607/?ref_=chttp_t_181,David Yates,"Steve Kloves, J.K. Rowling","Daniel Radcliffe, Emma Watson, Rupert Grint, Michael Gambon, Ralph Fiennes, Alan Rickman, Evanna Lynch, Domhnall Gleeson, Clémence Poésy, Warwick Davis, John Hurt, Helena Bonham Carter, Graham Duff, Anthony Allgood, Rusty Goffe, Jon Key, Kelly Macdonald, Jason Isaacs"
182,Bacheha-Ye aseman,https://www.imdb.com/title/tt0118849/?ref_=chttp_t_182,Majid Majidi,Majid Majidi,"Mohammad Amir Naji, Amir Farrokh Hashemian, Bahare Seddiqi, Nafise Jafar-Mohammadi, Fereshte Sarabandi, Kamal Mirkarimi, Behzad Rafi, Dariush Mokhtari, Mohammad-Hasan Hosseinian, Masume Dair, Kambiz Peykarnegar, Hasan Roohparvari, Abbas-Ali Roomandi, Jafar Seyfollahi, Qolamreza Maleki, Zahra Mirzai, Sara Zamani, Mohammad Haj Hosseini"
183,12 Years a Slave,https://www.imdb.com/title/tt2024544/?ref_=chttp_t_183,Steve McQueen,"John Ridley, Solomon Northup","Chiwetel Ejiofor, Michael Kenneth Williams, Michael Fassbender, Brad Pitt, Dwight Henry, Dickie Gravois, Bryan Batt, Ashley Dyke, Kelsey Scott, Quvenzhané Wallis, Cameron Zeigler, Tony Bentley, Scoot McNairy, Taran Killam, Christopher Berry, Bill Camp, Mister Mackey Jr., Chris Chalk"
184,Blade Runner,https://www.imdb.com/title/tt0083658/?ref_=chttp_t_184,Ridley Scott,"Hampton Fancher, David Webb Peoples, Philip K. Dick","Harrison Ford, Rutger Hauer, Sean Young, Edward James Olmos, M. Emmet Walsh, Daryl Hannah, William Sanderson, Brion James, Joe Turkel, Joanna Cassidy, James Hong, Morgan Paull, Kevin Thompson, John Edward Allen, Hy Pyke, Kimiko Hiroshige, Bob Okazaki, Carolyn DeMirjian"
185,Before Sunrise,https://www.imdb.com/title/tt0112471/?ref_=chttp_t_185,Richard Linklater,"Richard Linklater, Kim Krizan","Ethan Hawke, Julie Delpy, Andrea Eckert, Hanno Pöschl, Karl Bruckschwaiger, Tex Rubinowitz, Erni Mangold, Dominik Castell, Haymon Maria Buttinger, Harald Waiglein, Bilge Jeschim, Kurti, Hans Weingartner, Liese Lyon, Peter Ily Huemer, Otto Reiter, Hubert Fabian Kulterer, Branko Andric"
186,Ben-Hur,https://www.imdb.com/title/tt0052618/?ref_=chttp_t_186,William Wyler,"Lew Wallace, Karl Tunberg, Gore Vidal","Charlton Heston, Jack Hawkins, Stephen Boyd, Haya Harareet, Hugh Griffith, Martha Scott, ""Cathy ODonnell"", Sam Jaffe, Finlay Currie, Frank Thring, Terence Longdon, George Relph, André Morell, Umberto Alivernini, Armando Annuale, Artemio Antonini, Nello Appodia, Fortunato Arena"
187,The Grand Budapest Hotel,https://www.imdb.com/title/tt2278388/?ref_=chttp_t_187,Wes Anderson,"Stefan Zweig, Wes Anderson, Hugo Guinness","Ralph Fiennes, F. Murray Abraham, Mathieu Amalric, Adrien Brody, Willem Dafoe, Jeff Goldblum, Harvey Keitel, Jude Law, Bill Murray, Edward Norton, Saoirse Ronan, Jason Schwartzman, Léa Seydoux, Tilda Swinton, Tom Wilkinson, Owen Wilson, Tony Revolori, Larry Pine"
188,Barry Lyndon,https://www.imdb.com/title/tt0072684/?ref_=chttp_t_188,Stanley Kubrick,"Stanley Kubrick, William Makepeace Thackeray","""Ryan ONeal"", Marisa Berenson, Patrick Magee, Hardy Krüger, Steven Berkoff, Gay Hamilton, Marie Kean, Diana Körner, Murray Melvin, Frank Middlemass, André Morell, ""Arthur OSullivan"", Godfrey Quigley, Leonard Rossiter, Philip Stone, Leon Vitali, John Bindon, Roger Booth"
189,Gone Girl,https://www.imdb.com/title/tt2267998/?ref_=chttp_t_189,David Fincher,Gillian Flynn,"Ben Affleck, Rosamund Pike, Neil Patrick Harris, Tyler Perry, Carrie Coon, Kim Dickens, Patrick Fugit, David Clennon, Lisa Banes, Missi Pyle, Emily Ratajkowski, Casey Wilson, Lola Kirke, Boyd Holbrook, Sela Ward, Lee Norris, Jamie McShane, Leonard Kelly-Young"
190,Hacksaw Ridge,https://www.imdb.com/title/tt2119532/?ref_=chttp_t_190,Mel Gibson,"Robert Schenkkan, Andrew Knight","Andrew Garfield, Sam Worthington, Luke Bracey, Teresa Palmer, Richard Pyros, Jacob Warner, Milo Gibson, Darcy Bryce, Roman Guerriero, James Lugton, Kasia Stelmach, Hugo Weaving, Rachel Griffiths, Jarin Towney, Tim McGarry, Tyler Coppin, Richard Platt, Nathaniel Buzolic"
191,The Gold Rush,https://www.imdb.com/title/tt0015864/?ref_=chttp_t_191,Charles Chaplin,Charles Chaplin,"Charles Chaplin, Mack Swain, Tom Murray, Henry Bergman, Malcolm Waite, Georgia Hale, Jack Adams, Frank Aderias, Leona Aderias, Lillian Adrian, Sam Allen, Claude Anderson, Harry Arras, Albert Austin, Marta Belfort, William Bell, Francis Bernhardt, F.J. Beuaregard"
192,Salinui chueok,https://www.imdb.com/title/tt0353969/?ref_=chttp_t_192,Bong Joon Ho,"Bong Joon Ho, Kwang-rim Kim, Sung-bo Shim","Song Kang-ho, Kim Sang-kyung, Kim Roe-ha, Song Jae-ho, Byun Hee-Bong, Ko Seo-hie, Ryu Tae-ho, Park No-shik, Park Hae-il, Jeon Mi-seon, Seo Young-hwa, Woo Go-na, Ok-joo Lee, Choi Jong-ryol, Yoo Seung-mok, Hun-Kyung Lee, Shin Hyun-jong, Lee Jae-eung"
