Rank,English_Title,URL,Directors,Writers,Stars
65,Spider-Man: Into the Spider-Verse,https://www.imdb.com/title/tt4633694/?ref_=chttp_t_65,"Bob Persichetti, Peter Ramsey, Rodney Rothman","Phil Lord, Rodney Rothman","Shameik Moore, Jake Johnson, Hailee Steinfeld, Mahershala Ali, Brian Tyree Henry, Lily Tomlin, Luna Lauren Velez, Zoë Kravitz, John Mulaney, Kimiko Glenn, Nicolas Cage, Kathryn Hahn, Liev Schreiber, Chris Pine, Natalie Morales, Edwin R. Habacon, Oscar Isaac, Greta Lee"
66,The Shining,https://www.imdb.com/title/tt0081505/?ref_=chttp_t_66,Stanley Kubrick,"Stephen King, Stanley Kubrick, Diane Johnson","Jack Nicholson, Shelley Duvall, Danny Lloyd, Scatman Crothers, Barry Nelson, Philip Stone, Joe Turkel, Anne Jackson, Tony Burton, Lia Beldam, Billie Gibson, Barry Dennen, David Baxt, Manning Redwood, Lisa Burns, Louise Burns, Robin Pappas, Alison Coleridge"
67,Witness for the Prosecution,https://www.imdb.com/title/tt0051201/?ref_=chttp_t_67,Billy Wilder,"Agatha Christie, Billy Wilder, Harry Kurnitz","Tyrone Power, Marlene Dietrich, Charles Laughton, Elsa Lanchester, John Williams, Henry Daniell, Ian Wolfe, Torin Thatcher, Norma Varden, ""Una OConnor"", Francis Compton, Philip Tonge, Ruta Lee, Patrick Aherne, Don Ames, Walter Bacon, Eddie Baker, Benjie Bancroft"
68,The Great Dictator,https://www.imdb.com/title/tt0032553/?ref_=chttp_t_68,Charles Chaplin,Charles Chaplin,"Charles Chaplin, Paulette Goddard, Jack Oakie, Reginald Gardiner, Henry Daniell, Billy Gilbert, Grace Hayle, Carter DeHaven, Maurice Moscovitch, Emma Dunn, Bernard Gorcey, Paul Weigel, Chester Conklin, Esther Michelson, Hank Mann, Florence Wright, Eddie Gribbon, Rudolph Anders"
69,Aliens,https://www.imdb.com/title/tt0090605/?ref_=chttp_t_69,James Cameron,"James Cameron, David Giler, Walter Hill","Sigourney Weaver, Michael Biehn, Carrie Henn, Paul Reiser, Lance Henriksen, Bill Paxton, William Hope, Jenette Goldstein, Al Matthews, Mark Rolston, Ricco Ross, Colette Hiller, Daniel Kash, Cynthia Dale Scott, Tip Tipping, Trevor Steedman, Paul Maxwell, Valerie Colgan"
70,Inglourious Basterds,https://www.imdb.com/title/tt0361748/?ref_=chttp_t_70,Quentin Tarantino,Quentin Tarantino,"Brad Pitt, Diane Kruger, Eli Roth, Mélanie Laurent, Christoph Waltz, Michael Fassbender, Daniel Brühl, Til Schweiger, Gedeon Burkhard, Jacky Ido, B.J. Novak, Omar Doom, August Diehl, Denis Ménochet, Sylvester Groth, Martin Wuttke, Mike Myers, Julie Dreyfus"
71,The Dark Knight Rises,https://www.imdb.com/title/tt1345836/?ref_=chttp_t_71,Christopher Nolan,"Jonathan Nolan, Christopher Nolan, David S. Goyer","Christian Bale, Tom Hardy, Anne Hathaway, Gary Oldman, Joseph Gordon-Levitt, Marion Cotillard, Morgan Freeman, Michael Caine, Matthew Modine, Alon Aboutboul, Ben Mendelsohn, Burn Gorman, Daniel Sunjata, Aidan Gillen, Sam Kennard, Aliash Tepina, Nestor Carbonell, Brett Cullen"
72,Dr. Strangelove or: How I Learned to Stop Worrying and Love the Bomb,https://www.imdb.com/title/tt0057012/?ref_=chttp_t_72,Stanley Kubrick,"Stanley Kubrick, Terry Southern, Peter George","Peter Sellers, George C. Scott, Sterling Hayden, Keenan Wynn, Slim Pickens, Peter Bull, James Earl Jones, Tracy Reed, Jack Creley, Frank Berry, ""Robert ONeil"", Glenn Beck, Roy Stephens, Shane Rimmer, Hal Galili, Paul Tamarin, Laurence Herder, Gordon Tanner"
73,American Beauty,https://www.imdb.com/title/tt0169547/?ref_=chttp_t_73,Sam Mendes,Alan Ball,"Kevin Spacey, Annette Bening, Thora Birch, Wes Bentley, Mena Suvari, Peter Gallagher, Allison Janney, Chris Cooper, Scott Bakula, Sam Robards, Barry Del Sherman, Ara Celi, John Cho, Fort Atkinson, Sue Casey, Kent Faulcon, Brenda Wehle, Lisa Cloud"
74,Oldeuboi,https://www.imdb.com/title/tt0364569/?ref_=chttp_t_74,Park Chan-wook,"Garon Tsuchiya, Nobuaki Minegishi, Park Chan-wook","Choi Min-sik, Yoo Ji-tae, Kang Hye-jeong, Kim Byeong-Ok, Ji Dae-han, Oh Dal-su, Seung-shin Lee, Jin-Seo Yoon, Oh Tae-kyung, Yoo Yeon-Seok, Il-han Oo, Young-hee Lee, Young-ae Kim, Mi Mi Lee, Jae-Duk Han, Jung Ae Kwak, San Kim, Chae-soo Jang"
75,Coco,https://www.imdb.com/title/tt2380307/?ref_=chttp_t_75,"Lee Unkrich, Adrian Molina","Lee Unkrich, Jason Katz, Matthew Aldrich","Anthony Gonzalez, Gael García Bernal, Benjamin Bratt, Alanna Ubach, Renee Victor, Jaime Camil, Alfonso Arau, Herbert Siguenza, Gabriel Iglesias, Lombardo Boyar, Ana Ofelia Murguía, Natalia Cordova-Buckley, Selene Luna, Edward James Olmos, Sofía Espinosa, Carla Medina, Dyana Ortelli, Luis Valdez"
76,Amadeus,https://www.imdb.com/title/tt0086879/?ref_=chttp_t_76,Milos Forman,"Peter Shaffer, Zdenek Mahler","F. Murray Abraham, Tom Hulce, Elizabeth Berridge, Roy Dotrice, Simon Callow, Christine Ebersole, Jeffrey Jones, Charles Kay, Kenneth McMillan, Kenny Baker, Lisbeth Bartlett, Barbara Bryne, Martin Cavina, Roderick Cook, Milan Demjanenko, Peter DiGesu, Richard Frank, Patrick Hines"
77,Toy Story,https://www.imdb.com/title/tt0114709/?ref_=chttp_t_77,John Lasseter,"John Lasseter, Pete Docter, Andrew Stanton","Tom Hanks, Tim Allen, Don Rickles, Jim Varney, Wallace Shawn, John Ratzenberger, Annie Potts, John Morris, Erik von Detten, Laurie Metcalf, R. Lee Ermey, Sarah Rayne, Penn Jillette, Jack Angel, Spencer Aste, Greg Berg, Lisa Bradley, Kendall Cunningham"
78,Das Boot,https://www.imdb.com/title/tt0082096/?ref_=chttp_t_78,Wolfgang Petersen,"Wolfgang Petersen, Lothar G. Buchheim","Jürgen Prochnow, Herbert Grönemeyer, Klaus Wennemann, Hubertus Bengsch, Martin Semmelrogge, Bernd Tauber, Erwin Leder, Martin May, Heinz Hoenig, Uwe Ochsenknecht, Claude-Oliver Rudolph, Jan Fedder, Ralf Richter, Joachim Bernhard, Oliver Stritzel, Konrad Becker, Lutz Schnell, Martin Hemme"
79,Braveheart,https://www.imdb.com/title/tt0112573/?ref_=chttp_t_79,Mel Gibson,Randall Wallace,"Mel Gibson, Sophie Marceau, Patrick McGoohan, Angus Macfadyen, James Robinson, Sean Lawlor, Sandy Nelson, James Cosmo, Sean McGinley, Alan Tall, Andrew Weir, Gerda Stevenson, Ralph Riach, Mhairi Calvey, Brian Cox, Peter Hanly, Stephen Billington, Barry McGovern"
80,Avengers: Endgame,https://www.imdb.com/title/tt4154796/?ref_=chttp_t_80,"Anthony Russo, Joe Russo","Christopher Markus, Stephen McFeely, Stan Lee","Robert Downey Jr., Chris Evans, Mark Ruffalo, Chris Hemsworth, Scarlett Johansson, Jeremy Renner, Don Cheadle, Paul Rudd, Benedict Cumberbatch, Chadwick Boseman, Brie Larson, Tom Holland, Karen Gillan, Zoe Saldana, Evangeline Lilly, Tessa Thompson, Rene Russo, Elizabeth Olsen"
81,Joker,https://www.imdb.com/title/tt7286456/?ref_=chttp_t_81,Todd Phillips,"Todd Phillips, Scott Silver, Bob Kane","Joaquin Phoenix, Robert De Niro, Zazie Beetz, Frances Conroy, Brett Cullen, Shea Whigham, Bill Camp, Glenn Fleshler, Leigh Gill, Josh Pais, Rocco Luna, Marc Maron, Sondra James, Murphy Guyer, Douglas Hodge, Dante Pereira-Olson, Carrie Louise Putrello, Sharon Washington"
82,Mononoke-hime,https://www.imdb.com/title/tt0119698/?ref_=chttp_t_82,Hayao Miyazaki,"Hayao Miyazaki, Neil Gaiman","Yôji Matsuda, Yuriko Ishida, Yûko Tanaka, Billy Crudup, Billy Bob Thornton, Minnie Driver, John DiMaggio, Claire Danes, John DeMita, Jada Pinkett Smith, Gillian Anderson, Keith David, Corey Burton, Tara Strong, Julia Fletcher, Debi Derryberry, Alex Fernandez, Jack Fletcher"
83,Good Will Hunting,https://www.imdb.com/title/tt0119217/?ref_=chttp_t_83,Gus Van Sant,"Matt Damon, Ben Affleck","Robin Williams, Matt Damon, Ben Affleck, Stellan Skarsgård, John Mighton, Rachel Majorowski, Colleen McCauley, Casey Affleck, Cole Hauser, Matt Mercier, Ralph St. George, Rob Lynds, Dan Washington, Alison Folland, Derrick Bridgeman, Vik Sahay, Shannon Egleson, Rob Lyons"
84,Kimi no na wa.,https://www.imdb.com/title/tt5311514/?ref_=chttp_t_84,Makoto Shinkai,"Makoto Shinkai, Clark Cheng","Ryunosuke Kamiki, Mone Kamishiraishi, Ryo Narita, Aoi Yûki, Nobunaga Shimazaki, Kaito Ishikawa, Kanon Tani, Masaki Terasoma, Sayaka Ôhara, Kazuhiko Inoue, Chafûrin, Kana Hanazawa, Yuka Terasaki, Takashi Onozuka, Yôhei Namekawa, Miyu Tsuji, ""Shinya Hamazoe"", Kanami Satô"
85,Once Upon a Time in America,https://www.imdb.com/title/tt0087843/?ref_=chttp_t_85,Sergio Leone,"Harry Grey, Leonardo Benvenuti, Piero De Bernardi","Robert De Niro, James Woods, Elizabeth McGovern, Treat Williams, Tuesday Weld, Burt Young, Joe Pesci, Danny Aiello, William Forsythe, James Hayden, Darlanne Fluegel, Larry Rapp, Dutch Miller, Robert Harper, Richard Bright, Gerard Murphy, Amy Ryder, Olga Karlatos"
86,Tengoku to jigoku,https://www.imdb.com/title/tt0057565/?ref_=chttp_t_86,Akira Kurosawa,"Hideo Oguni, Ryûzô Kikushima, Eijirô Hisaita","Toshirô Mifune, Yutaka Sada, Tatsuya Nakadai, Kyôko Kagawa, Tatsuya Mihashi, Isao Kimura, Kenjirô Ishiyama, Takeshi Katô, Takashi Shimura, Jun Tazaki, Nobuo Nakamura, Yûnosuke Itô, Tsutomu Yamazaki, Minoru Chiaki, Eijirô Tôno, Masao Shimizu, Masahiko Shimazu, Toshio Egi"
87,3 Idiots,https://www.imdb.com/title/tt1187043/?ref_=chttp_t_87,Rajkumar Hirani,"Abhijat Joshi, Rajkumar Hirani, Vidhu Vinod Chopra","Aamir Khan, Madhavan, Mona Singh, Sharman Joshi, Kareena Kapoor, Boman Irani, Omi Vaidya, Jaaved Jaaferi, Parikshit Sahni, Olivier Lafont, Rahul Kumar, Amardeep Jha, Farida Dadi, Mukund Bhatt, Chaitali Bose, Jayant Kripalani, Arun Bali, Shoaib Ahmed"
88,Singin' in the Rain,https://www.imdb.com/title/tt0045152/?ref_=chttp_t_88,"Stanley Donen, Gene Kelly","Betty Comden, Adolph Green","Gene Kelly, ""Donald OConnor"", Debbie Reynolds, Jean Hagen, Millard Mitchell, Cyd Charisse, Douglas Fowley, Rita Moreno, Dawn Addams, John Albright, Betty Allen, Sue Allen, John Angelo, Marie Ardell, Bette Arlen, David Bair, Jimmy Bates, Mary Bayless"
89,Capharnaüm,https://www.imdb.com/title/tt8267604/?ref_=chttp_t_89,Nadine Labaki,"Nadine Labaki, Jihad Hojeily, Michelle Keserwany","Zain Al Rafeea, Yordanos Shiferaw, Boluwatife Treasure Bankole, Kawsar Al Haddad, Fadi Yousef, Cedra Izzam, Alaa Chouchnieh, Elias Khoury, Mohammad Al Abdallah, Mohamad Abdellatif, Abdo Abdo, Hampig Abraham, Jamil Ahmad, Mohamad Akkar, Elias Akobegia, Riman Al Rafeea, Legamett Alamou, Majd Nabil Alhalabi"
90,Oppenheimer,https://www.imdb.com/title/tt15398776/?ref_=chttp_t_90,Christopher Nolan,"Christopher Nolan, Kai Bird, Martin Sherwin","Cillian Murphy, Emily Blunt, Matt Damon, Robert Downey Jr., Alden Ehrenreich, Scott Grimes, Jason Clarke, Kurt Koehler, Tony Goldwyn, John Gowans, Macon Blair, ""James DArcy"", Kenneth Branagh, Harry Groener, Gregory Jbara, Ted King, Tim DeKay, Steven Houska"
91,Requiem for a Dream,https://www.imdb.com/title/tt0180093/?ref_=chttp_t_91,Darren Aronofsky,"Hubert Selby Jr., Darren Aronofsky","Ellen Burstyn, Jared Leto, Jennifer Connelly, Marlon Wayans, Christopher McDonald, Louise Lasser, Marcia Jean Kurtz, Janet Sarno, Suzanne Shepherd, Joanne Gordon, Charlotte Aronofsky, Mark Margolis, Michael Kaycheck, ""Jack OConnell"", Chas Mastin, Ajay Naidu, Sean Gullette, Samia Shoaib"
92,Idi i smotri,https://www.imdb.com/title/tt0091251/?ref_=chttp_t_92,Elem Klimov,"Ales Adamovich, Elem Klimov","Aleksey Kravchenko, Olga Mironova, Liubomiras Laucevicius, Vladas Bagdonas, Jüri Lumiste, Viktors Lorencs, Kazimir Rabetsky, Evgeniy Tilicheev, G. Velts, V. Vasilyev, Aleksandr Berda, Vasiliy Domrachyov, Nina Evdokimova, Igor Gnevashev, Adolf Hitler, Valery Kravchenko, Evgeniy Kryzhanovskiy, N. Lisichenok"
93,Toy Story 3,https://www.imdb.com/title/tt0435761/?ref_=chttp_t_93,Lee Unkrich,"John Lasseter, Andrew Stanton, Lee Unkrich","Tom Hanks, Tim Allen, Joan Cusack, Ned Beatty, Don Rickles, Michael Keaton, Wallace Shawn, John Ratzenberger, Estelle Harris, John Morris, Jodi Benson, Emily Ricks Hahn, Laurie Metcalf, Blake Clark, Teddy Newton, Bud Luckey, Bea Miller, Javier Fernández-Peña"
94,Star Wars: Episode VI - Return of the Jedi,https://www.imdb.com/title/tt0086190/?ref_=chttp_t_94,Richard Marquand,"Lawrence Kasdan, George Lucas","Mark Hamill, Harrison Ford, Carrie Fisher, Billy Dee Williams, Anthony Daniels, Peter Mayhew, Sebastian Shaw, Ian McDiarmid, Frank Oz, James Earl Jones, David Prowse, Alec Guinness, Kenny Baker, Michael Pennington, Kenneth Colley, Michael Carter, Denis Lawson, Tim Rose"
95,Eternal Sunshine of the Spotless Mind,https://www.imdb.com/title/tt0338013/?ref_=chttp_t_95,Michel Gondry,"Charlie Kaufman, Michel Gondry, Pierre Bismuth","Jim Carrey, Kate Winslet, Tom Wilkinson, Gerry Robert Byrne, Elijah Wood, Thomas Jay Ryan, Mark Ruffalo, Jane Adams, David Cross, Kirsten Dunst, Ryan Whitney, Debbon Ayer, Amir Ali Said, Brian Price, Paulie Litt, Josh Flitter, Lola Daehler, ""Deirdre OConnell"""
96,Jagten,https://www.imdb.com/title/tt2106476/?ref_=chttp_t_96,Thomas Vinterberg,"Thomas Vinterberg, Tobias Lindholm","Mads Mikkelsen, Thomas Bo Larsen, Annika Wedderkopp, Lasse Fogelstrøm, Susse Wold, Anne Louise Hassing, Lars Ranthe, Alexandra Rapaport, Sebastian Bull, Steen Ordell Guldbrand Jensen, Daniel Engstrup, Troels Thorsen, Søren Rønholt, Hana Shuan, Jytte Kvinesdal, Josefine Gråbøl, Bjarne Henriksen, Nicolai Dahl Hamilton"
97,2001: A Space Odyssey,https://www.imdb.com/title/tt0062622/?ref_=chttp_t_97,Stanley Kubrick,"Stanley Kubrick, Arthur C. Clarke","Keir Dullea, Gary Lockwood, William Sylvester, Daniel Richter, Leonard Rossiter, Margaret Tyzack, Robert Beatty, Sean Sullivan, Douglas Rain, Frank W. Miller, Bill Weston, Ed Bishop, Glenn Beck, Alan Gifford, Ann Gillis, Edwina Carroll, Penny Brahms, Heather Downham"
98,Reservoir Dogs,https://www.imdb.com/title/tt0105236/?ref_=chttp_t_98,Quentin Tarantino,"Quentin Tarantino, Roger Avary","Harvey Keitel, Tim Roth, Michael Madsen, Chris Penn, Steve Buscemi, Lawrence Tierney, Randy Brooks, Kirk Baltz, Edward Bunker, Quentin Tarantino, Rich Turner, David Steen, Tony Cosmo, Stevo Polyi, Michael Sottile, Robert Ruth, Lawrence Bender, Linda Kaye"
99,Ikiru,https://www.imdb.com/title/tt0044741/?ref_=chttp_t_99,Akira Kurosawa,"Akira Kurosawa, Shinobu Hashimoto, Hideo Oguni","Takashi Shimura, Nobuo Kaneko, ""Shinichi Himori"", Haruo Tanaka, Minoru Chiaki, Miki Odagiri, Bokuzen Hidari, Minosuke Yamada, Kamatari Fujiwara, Makoto Kobori, Nobuo Nakamura, Atsushi Watanabe, Isao Kimura, Masao Shimizu, Yûnosuke Itô, Kumeko Urabe, Eiko Miyoshi, Noriko Honma"
100,Lawrence of Arabia,https://www.imdb.com/title/tt0056172/?ref_=chttp_t_100,David Lean,"Robert Bolt, Michael Wilson","""Peter OToole"", Alec Guinness, Anthony Quinn, Jack Hawkins, Omar Sharif, José Ferrer, Anthony Quayle, Claude Rains, Arthur Kennedy, Donald Wolfit, I.S. Johar, Gamil Ratib, Michel Ray, John Dimech, Zia Mohyeddin, Howard Marion-Crawford, Jack Gwillim, Hugh Miller"
101,The Apartment,https://www.imdb.com/title/tt0053604/?ref_=chttp_t_101,Billy Wilder,"Billy Wilder, I.A.L. Diamond","Jack Lemmon, Shirley MacLaine, Fred MacMurray, Ray Walston, Jack Kruschen, David Lewis, Hope Holiday, Joan Shawlee, Naomi Stevens, Johnny Seven, Joyce Jameson, Willard Waterman, David White, Edie Adams, Dorothy Abbott, Bill Baldwin, Paul Bradley, Benny Burt"
102,North by Northwest,https://www.imdb.com/title/tt0053125/?ref_=chttp_t_102,Alfred Hitchcock,Ernest Lehman,"Cary Grant, Eva Marie Saint, James Mason, Jessie Royce Landis, Leo G. Carroll, Josephine Hutchinson, Philip Ober, Martin Landau, Adam Williams, Edward Platt, Robert Ellenstein, Les Tremayne, Philip Coolidge, Patrick McVey, Edward Binns, Ken Lynch, Stanley Adams, John Alban"
103,Citizen Kane,https://www.imdb.com/title/tt0033467/?ref_=chttp_t_103,Orson Welles,"Herman J. Mankiewicz, Orson Welles, John Houseman","Orson Welles, Joseph Cotten, Dorothy Comingore, Agnes Moorehead, Ruth Warrick, Ray Collins, Erskine Sanford, Everett Sloane, William Alland, Paul Stewart, George Coulouris, Fortunio Bonanova, Gus Schilling, Philip Van Zandt, Georgia Backus, Harry Shannon, Sonny Bupp, Buddy Swan"
104,Incendies,https://www.imdb.com/title/tt1255953/?ref_=chttp_t_104,Denis Villeneuve,"Denis Villeneuve, Wajdi Mouawad, Valérie Beaugrand-Champagne","Lubna Azabal, Mélissa Désormeaux-Poulin, Maxim Gaudette, Mustafa Kamel, Hussein Sami, Rémy Girard, Dominique Briand, Frédéric Paquet, Hamed Najem, Ahmad Massad, Bader Alami, Majida Hussein, Asriah Nijres, John Dunn-Hill, Nadia Essadiqi, Chaouki Charbel, Axel Garbi, Amine Benzenine"
105,Vertigo,https://www.imdb.com/title/tt0052357/?ref_=chttp_t_105,Alfred Hitchcock,"Alec Coppel, Samuel A. Taylor, Pierre Boileau","James Stewart, Kim Novak, Barbara Bel Geddes, Tom Helmore, Henry Jones, Raymond Bailey, Ellen Corby, Konstantin Shayne, Lee Patrick, David Ahdar, Isabel Analla, Jack Ano, Margaret Bacon, John Benson, Danny Borzage, Margaret Brayton, Paul Bryar, Boyd Cabeen"
106,M - Eine Stadt sucht einen Mörder,https://www.imdb.com/title/tt0022100/?ref_=chttp_t_106,Fritz Lang,"Thea von Harbou, Fritz Lang, Egon Jacobsohn","Peter Lorre, Ellen Widmann, Inge Landgut, Otto Wernicke, Theodor Loos, Gustaf Gründgens, Friedrich Gnaß, Fritz Odemar, Paul Kemp, Theo Lingen, Rudolf Blümner, Georg John, Franz Stein, Ernst Stahl-Nachbaur, Gerhard Bienert, Karl Platen, Rosa Valetti, Hertha von Walther"
107,Double Indemnity,https://www.imdb.com/title/tt0036775/?ref_=chttp_t_107,Billy Wilder,"Billy Wilder, Raymond Chandler, James M. Cain","Fred MacMurray, Barbara Stanwyck, Edward G. Robinson, Byron Barr, Porter Hall, Jean Heather, Tom Powers, Richard Gaines, Fortunio Bonanova, John Philliber, Lev Abramov, James Adamson, John Berry, Raymond Chandler, Edmund Cobb, Kernan Cripps, Betty Farrington, Bess Flowers"
108,Scarface,https://www.imdb.com/title/tt0086250/?ref_=chttp_t_108,Brian De Palma,"Oliver Stone, Howard Hawks, Ben Hecht","Al Pacino, Michelle Pfeiffer, Steven Bauer, Mary Elizabeth Mastrantonio, Robert Loggia, Miriam Colon, F. Murray Abraham, Paul Shenar, Harris Yulin, Ángel Salazar, Arnaldo Santana, Pepe Serna, Michael P. Moran, Al Israel, Dennis Holahan, Mark Margolis, Michael Alldredge, Ted Beniades"
109,Le fabuleux destin d'Amélie Poulain,https://www.imdb.com/title/tt0211915/?ref_=chttp_t_109,Jean-Pierre Jeunet,"Guillaume Laurant, Jean-Pierre Jeunet","Audrey Tautou, Mathieu Kassovitz, Rufus, Lorella Cravotta, Serge Merlin, Jamel Debbouze, Clotilde Mollet, Claire Maurier, Isabelle Nanty, Dominique Pinon, Artus de Penguern, Yolande Moreau, Urbain Cancelier, Maurice Bénichou, Michel Robin, Andrée Damant, Claude Perron, Armelle"
110,Full Metal Jacket,https://www.imdb.com/title/tt0093058/?ref_=chttp_t_110,Stanley Kubrick,"Stanley Kubrick, Michael Herr, Gustav Hasford","Matthew Modine, R. Lee Ermey, ""Vincent DOnofrio"", Adam Baldwin, Dorian Harewood, Kevyn Major Howard, Arliss Howard, ""Ed ORoss"", John Terry, Kieron Jecchinis, Kirk Taylor, Tim Colceri, Jon Stafford, Bruce Boa, Ian Tyler, Sal Lopez, Gary Landon Mills, Papillon Soo"
111,A Clockwork Orange,https://www.imdb.com/title/tt0066921/?ref_=chttp_t_111,Stanley Kubrick,"Stanley Kubrick, Anthony Burgess","Malcolm McDowell, Patrick Magee, Michael Bates, Warren Clarke, John Clive, Adrienne Corri, Carl Duering, Paul Farrell, Clive Francis, Michael Gover, Miriam Karlin, James Marcus, Aubrey Morris, Godfrey Quigley, Sheila Raynor, Madge Ryan, John Savident, Anthony Sharp"
112,Heat,https://www.imdb.com/title/tt0113277/?ref_=chttp_t_112,Michael Mann,Michael Mann,"Al Pacino, Robert De Niro, Val Kilmer, Jon Voight, Tom Sizemore, Diane Venora, Amy Brenneman, Ashley Judd, Mykelti Williamson, Wes Studi, Ted Levine, Dennis Haysbert, William Fichtner, Natalie Portman, Tom Noonan, Kevin Gage, Hank Azaria, Susan Traylor"
113,Up,https://www.imdb.com/title/tt1049413/?ref_=chttp_t_113,"Pete Docter, Bob Peterson","Pete Docter, Bob Peterson, Tom McCarthy","Edward Asner, Jordan Nagai, John Ratzenberger, Christopher Plummer, Bob Peterson, Delroy Lindo, Jerome Ranft, David Kaye, Elie Docter, Jeremy Leary, Mickie McGowan, Danny Mann, Donald Fullilove, Jess Harnell, Josh Cooley, Pete Docter, Mark Andrews, Bob Bergen"
114,To Kill a Mockingbird,https://www.imdb.com/title/tt0056592/?ref_=chttp_t_114,Robert Mulligan,"Harper Lee, Horton Foote","Gregory Peck, John Megna, Frank Overton, Rosemary Murphy, Ruth White, Brock Peters, Estelle Evans, Paul Fix, Collin Wilcox Paxton, James Anderson, Alice Ghostley, Robert Duvall, William Windom, Crahan Denton, Richard Hale, Mary Badham, Phillip Alford, R.L. Armstrong"
115,The Sting,https://www.imdb.com/title/tt0070735/?ref_=chttp_t_115,George Roy Hill,David S. Ward,"Paul Newman, Robert Redford, Robert Shaw, Charles Durning, Ray Walston, Eileen Brennan, Harold Gould, John Heffernan, Dana Elcar, Jack Kehoe, Dimitra Arliss, Robert Earl Jones, James Sloyan, Charles Dierkop, Lee Paul, Sally Kirkland, Avon Long, Arch Johnson"
116,Jodaeiye Nader az Simin,https://www.imdb.com/title/tt1832382/?ref_=chttp_t_116,Asghar Farhadi,Asghar Farhadi,"Payman Maadi, Leila Hatami, Sareh Bayat, Shahab Hosseini, Sarina Farhadi, Babak Karimi, Ali-Asghar Shahbazi, Kimia Hosseini, Shirin Yazdanbakhsh, ""Merila Zarei"", Mohammadhasan Asghari, Shirin Azimiyannezhad, Hamid Dadju, Mohammad Ebrahimian, Samad Farhang, Ali Fattahi, Nafise Ghodrati, Roya Hosseini"
117,Indiana Jones and the Last Crusade,https://www.imdb.com/title/tt0097576/?ref_=chttp_t_117,Steven Spielberg,"Jeffrey Boam, George Lucas, Menno Meyjes","Harrison Ford, Sean Connery, Alison Doody, Denholm Elliott, John Rhys-Davies, Julian Glover, River Phoenix, Michael Byrne, Kevork Malikyan, Robert Eddison, Richard Young, Alexei Sayle, Alex Hyde-White, Paul Maxwell, Isla Blair, Vernon Dobtcheff, J.J. Hardy, Bradley Gregg"
118,Die Hard,https://www.imdb.com/title/tt0095016/?ref_=chttp_t_118,John McTiernan,"Roderick Thorp, Jeb Stuart, Steven E. de Souza","Bruce Willis, Alan Rickman, Bonnie Bedelia, Reginald VelJohnson, Paul Gleason, ""Devoreaux White"", William Atherton, Hart Bochner, James Shigeta, Alexander Godunov, Bruno Doyon, Andreas Wisniewski, Clarence Gilyard Jr., Joseph Plewa, Lorenzo Caccialanza, Gérard Bonn, Dennis Hayden, Al Leong"
119,Metropolis,https://www.imdb.com/title/tt0017136/?ref_=chttp_t_119,Fritz Lang,"Thea von Harbou, Fritz Lang","Brigitte Helm, Alfred Abel, Gustav Fröhlich, Rudolf Klein-Rogge, Fritz Rasp, Theodor Loos, Erwin Biswanger, Heinrich George, Fritz Alberti, Grete Berger, Olly Boeheim, Max Dietze, Ellen Frey, Beatrice Garga, Heinrich Gotho, Dolly Grey, Anny Hintze, Gottfried Huppertz"
120,Taare Zameen Par,https://www.imdb.com/title/tt0986264/?ref_=chttp_t_120,"Aamir Khan, Amole Gupte",Amole Gupte,"Darsheel Safary, Aamir Khan, Tisca Chopra, Vipin Sharma, Tanay Chheda, Sachet Engineer, Girija Oak, Lalitha Lajmi, Ravi Khanvilkar, Pratima V. Kulkarni, Meghna Malik, Sonali Sachdev, Sanjay Dadhich, Rajgopal Iyer, Bugs Bhargava Krishna, Shankar Sachdev, M.K. Raina, Gurkirtan"
121,Hamilton,https://www.imdb.com/title/tt8503618/?ref_=chttp_t_121,Thomas Kail,"Lin-Manuel Miranda, Ron Chernow","Lin-Manuel Miranda, Phillipa Soo, Leslie Odom Jr., Renée Elise Goldsberry, Daveed Diggs, Jonathan Groff, Chris Jackson, Jasmine Cephas Jones, Okieriete Onaodowan, Anthony Ramos, Carleigh Bettiol, Ariana DeBose, Hope Easterbrook, Sydney James Harcourt, Sasha Hutchings, Thayne Jasperson, Elizabeth Judd, Jon Rua"
122,Snatch,https://www.imdb.com/title/tt0208092/?ref_=chttp_t_122,Guy Ritchie,Guy Ritchie,"Jason Statham, Brad Pitt, Stephen Graham, Vinnie Jones, Ade, William Beck, Andy Beckwith, Ewen Bremner, Jason Buckham, Mickey Cantwell, Nicola Collins, Teena Collins, Charles Cork, James Cunningham, Sorcha Cusack, Mickey Dee, Benicio Del Toro, Sam Douglas"
123,L.A. Confidential,https://www.imdb.com/title/tt0119488/?ref_=chttp_t_123,Curtis Hanson,"James Ellroy, Brian Helgeland, Curtis Hanson","Kevin Spacey, Russell Crowe, Guy Pearce, Kim Basinger, James Cromwell, Danny DeVito, David Strathairn, Ron Rifkin, Matt McCoy, Paul Guilfoyle, Paolo Seganti, Elisabeth Granli, Sandra Taylor, Steve Rankin, Graham Beckel, Allan Graf, Precious Chong, Symba"
124,Ladri di biciclette,https://www.imdb.com/title/tt0040522/?ref_=chttp_t_124,Vittorio De Sica,"Cesare Zavattini, Luigi Bartolini, Oreste Biancoli","Lamberto Maggiorani, Enzo Staiola, Lianella Carell, Elena Altieri, Gino Saltamerenda, Giulio Chiari, Vittorio Antonucci, Michele Sakara, Fausto Guerzoni, Emma Druetti, Carlo Jachino, Giulio Battiferri, Ida Bracci Dorati, Nando Bruno, Eolo Capritti, Memmo Carotenuto, Giovanni Corporale, Veriano Ginesi"
125,1917,https://www.imdb.com/title/tt8579674/?ref_=chttp_t_125,Sam Mendes,"Sam Mendes, Krysty Wilson-Cairns","Dean-Charles Chapman, George MacKay, Daniel Mays, Colin Firth, Pip Carter, Andy Apollo, Paul Tinto, Josef Davies, Billy Postlethwaite, Gabriel Akuwudike, Andrew Scott, Spike Leighton, Robert Maaser, Gerran Howell, Adam Hugill, Mark Strong, Richard McCabe, Benjamin Adams"
126,Taxi Driver,https://www.imdb.com/title/tt0075314/?ref_=chttp_t_126,Martin Scorsese,Paul Schrader,"Robert De Niro, Jodie Foster, Cybill Shepherd, Albert Brooks, Diahnne Abbott, Frank Adu, Victor Argo, Gino Ardito, Garth Avery, Peter Boyle, Harry Cohn, Copper Cunningham, Brenda Dickson, Harry Fischler, Nat Grant, Leonard Harris, Richard Higgs, Beau Kayser"
127,Der Untergang,https://www.imdb.com/title/tt0363163/?ref_=chttp_t_127,Oliver Hirschbiegel,"Bernd Eichinger, Joachim Fest, Traudl Junge","Bruno Ganz, Alexandra Maria Lara, Ulrich Matthes, Juliane Köhler, Corinna Harfouch, Heino Ferch, Christian Berkel, Matthias Habich, Thomas Kretschmann, Michael Mendl, André Hennicke, Ulrich Noethen, Birgit Minichmayr, Rolf Kanies, Justus von Dohnányi, Dieter Mann, Christian Redl, Götz Otto"
128,Dangal,https://www.imdb.com/title/tt5074352/?ref_=chttp_t_128,Nitesh Tiwari,"Piyush Gupta, Shreyas Jain, Nikhil Mehrotra","Aamir Khan, Sakshi Tanwar, Fatima Sana Shaikh, Sanya Malhotra, Aparshakti Khurana, Zaira Wasim, Suhani Bhatnagar, Ritvik Sahore, Girish Kulkarni, Ravi Aneja, Anurag Arora, Mahesh Balraj, Vivan Bhatena, Anmol Charan, Karamveer Choudhary, Ishika Gagneja, Badrul Islam, Jagbir"
