Rank,English_Title,URL,Directors,Writers,Stars
193,In the Name of the Father,https://www.imdb.com/title/tt0107207/?ref_=chttp_t_193,Jim Sheridan,"Gerry Conlon, Terry George, Jim Sheridan","Daniel Day-Lewis, Pete Postlethwaite, Alison Crosbie, Philip King, Emma Thompson, Nye Heron, Anthony Brophy, Frankie McCafferty, Paul Warriner, Julian Walsh, Stuart Wolfenden, Jo Connor, Karen Carlisle, Seamus Moran, Billy Byrne, Maureen McBride, Jane Nolan, Laurence Griffin"
194,Dead Poets Society,https://www.imdb.com/title/tt0097165/?ref_=chttp_t_194,Peter Weir,Tom Schulman,"Robin Williams, Robert Sean Leonard, Ethan Hawke, Josh Charles, Gale Hansen, Dylan Kussman, Allelon Ruggiero, James Waterston, Norman Lloyd, Kurtwood Smith, Carla Belver, Leon Pownall, George Martin, Joe Aufiery, Matt Carey, Kevin Cooney, Jane Moore, Lara Flynn Boyle"
195,On the Waterfront,https://www.imdb.com/title/tt0047296/?ref_=chttp_t_195,Elia Kazan,"Budd Schulberg, Malcolm Johnson, Robert Siodmak","Marlon Brando, Karl Malden, Lee J. Cobb, Rod Steiger, Pat Henning, Leif Erickson, James Westerfield, Tony Galento, Tami Mauriello, John F. Hamilton, John Heldabrand, Rudy Bond, Don Blackman, Arthur Keegan, Abe Simon, Eva Marie Saint, Martin Balsam, Dan Bergin"
196,The Deer Hunter,https://www.imdb.com/title/tt0077416/?ref_=chttp_t_196,Michael Cimino,"Michael Cimino, Deric Washburn, Louis Garfinkle","Robert De Niro, Christopher Walken, John Cazale, John Savage, Meryl Streep, George Dzundza, Chuck Aspegren, Shirley Stoler, Rutanya Alda, Pierre Segui, Mady Kaplan, Amy Wright, Mary Ann Haenel, Richard Kuss, Joe Grifasi, Christopher Colombi Jr., Victoria Karnafel, Jack Scardino"
197,The General,https://www.imdb.com/title/tt0017925/?ref_=chttp_t_197,"Clyde Bruckman, Buster Keaton","Buster Keaton, Clyde Bruckman, Al Boasberg","Buster Keaton, Marion Mack, Glen Cavender, Jim Farley, Frederick Vroom, Frank Barnes, Charles Henry Smith, Joe Keaton, Mike Donlin, Tom Nawn, Henry Baird, Joe Bricher, Jimmy Bryant, Sergeant Bukowski, C.C. Cruson, Jack Dempster, Keith Fennell, Budd Fine"
198,Relatos salvajes,https://www.imdb.com/title/tt3011894/?ref_=chttp_t_198,Damián Szifron,"Julian Loyola, Damián Szifron, Germán Servidio","Darío Grandinetti, María Marull, Mónica Villa, Diego Starosta, Marcelo Frasca, Lucila Mangone, María Laura Caccamo, Carlos Alberto Vavassori, Pablo Machado, Horacio Vay, Javier Pedersoli, Héctor Drachtman, María Rosa López Ottonello, Rita Cortese, Julieta Zylberberg, César Bordón, Juan Santiago Linari, Leonardo Sbaraglia"
199,Mad Max: Fury Road,https://www.imdb.com/title/tt1392190/?ref_=chttp_t_199,George Miller,"George Miller, Brendan McCarthy, Nick Lathouris","Tom Hardy, Charlize Theron, Nicholas Hoult, Zoë Kravitz, Hugh Keays-Byrne, Josh Helman, Nathan Jones, Rosie Huntington-Whiteley, Riley Keough, Abbey Lee, Courtney Eaton, John Howard, Richard Carter, Iota, Angus Sampson, Jennifer Hagan, Megan Gale, Melissa Jaffer"
200,"Monsters, Inc.",https://www.imdb.com/title/tt0198781/?ref_=chttp_t_200,"Pete Docter, David Silverman, Lee Unkrich","Pete Docter, Jill Culton, Jeff Pidgeon","Billy Crystal, John Goodman, Mary Gibbs, Steve Buscemi, James Coburn, Jennifer Tilly, Bob Peterson, John Ratzenberger, Frank Oz, Daniel Gerson, Steve Susskind, Bonnie Hunt, Jeff Pidgeon, Samuel Lord Black, Jack Angel, Bob Bergen, Rodger Bumpass, Gino Conforti"
201,Sherlock Jr.,https://www.imdb.com/title/tt0015324/?ref_=chttp_t_201,Buster Keaton,"Jean C. Havez, Joseph A. Mitchell, Clyde Bruckman","Buster Keaton, Kathryn McGuire, Joe Keaton, Erwin Connelly, Ward Crane, Jane Connelly, George Davis, Doris Deane, Christine Francis, Betsy Ann Hisle, Kewpie Morgan, Steve Murphy, John Patrick, Ford West"
202,The Third Man,https://www.imdb.com/title/tt0041959/?ref_=chttp_t_202,Carol Reed,"Graham Greene, Orson Welles, Alexander Korda","Orson Welles, Joseph Cotten, Alida Valli, Trevor Howard, Paul Hörbiger, Ernst Deutsch, Erich Ponto, Siegfried Breuer, Hedwig Bleibtreu, Bernard Lee, Wilfrid Hyde-White, Nelly Arno, Jack Arrow, Harold Ayer, Harry Belcher, Leo Bieber, Paul Birch, Martin Boddey"
203,Smultronstället,https://www.imdb.com/title/tt0050986/?ref_=chttp_t_203,Ingmar Bergman,Ingmar Bergman,"Victor Sjöström, Bibi Andersson, Ingrid Thulin, Gunnar Björnstrand, Jullan Kindahl, Folke Sundquist, Björn Bjelfvenstam, Naima Wifstrand, Gunnel Broström, Gertrud Fridh, Sif Ruud, Gunnar Sjöberg, Max von Sydow, Åke Fridell, Yngve Nordwall, Per Sjöstrand, Gio Petré, Gunnel Lindblom"
204,Le salaire de la peur,https://www.imdb.com/title/tt0046268/?ref_=chttp_t_204,Henri-Georges Clouzot,"Georges Arnaud, Henri-Georges Clouzot, Jérôme Géronimi","Yves Montand, Charles Vanel, Peter van Eyck, Folco Lulli, Véra Clouzot, William Tubbs, Darío Moreno, Jo Dest, Antonio Centa, Luis De Lima, Grégoire Gromoff, Josep Palau i Fabre, Faustini, Seguna, Darling Légitimus, René Baranger, Charles Fawcett, Pat Hurst"
205,Jaws,https://www.imdb.com/title/tt0073195/?ref_=chttp_t_205,Steven Spielberg,"Peter Benchley, Carl Gottlieb","Roy Scheider, Robert Shaw, Richard Dreyfuss, Lorraine Gary, Murray Hamilton, Carl Gottlieb, Jeffrey Kramer, Susan Backlinie, Jonathan Filley, Ted Grossman, Chris Rebello, Jay Mello, Lee Fierro, Jeffrey Voorhees, Craig Kingsbury, Robert Nevin, Peter Benchley, Jonathan Searle"
206,How to Train Your Dragon,https://www.imdb.com/title/tt0892769/?ref_=chttp_t_206,"Dean DeBlois, Chris Sanders","William Davies, Dean DeBlois, Chris Sanders","Jay Baruchel, Gerard Butler, Christopher Mintz-Plasse, Craig Ferguson, America Ferrera, Jonah Hill, T.J. Miller, Kristen Wiig, Robin Atkin Downes, Philip McGrade, Kieron Elliott, Ashley Jensen, David Tennant"
207,Mary and Max.,https://www.imdb.com/title/tt0978762/?ref_=chttp_t_207,Adam Elliot,Adam Elliot,"Toni Collette, Philip Seymour Hoffman, Eric Bana, Barry Humphries, Christopher Massey, Oliver Marks, Daisy Kocher, Daniel Marks, Hamish Hughes, Dan Doherty, Julie Forsyth, Mandy Mao, Patrick McCabe, Adam Elliot, Mr. Peck, Michael James Allen, Bill Murphy, Shaun Patten"
208,Mr. Smith Goes to Washington,https://www.imdb.com/title/tt0031679/?ref_=chttp_t_208,Frank Capra,"Sidney Buchman, Lewis R. Foster, Myles Connolly","James Stewart, Jean Arthur, Claude Rains, Edward Arnold, Guy Kibbee, Thomas Mitchell, Eugene Pallette, Beulah Bondi, H.B. Warner, Harry Carey, Astrid Allwyn, Ruth Donnelly, Grant Mitchell, Porter Hall, H.V. Kaltenborn, Charles Lane, Pierre Watkin, Dick Elliott"
209,Ratatouille,https://www.imdb.com/title/tt0382932/?ref_=chttp_t_209,"Brad Bird, Jan Pinkava","Brad Bird, Jan Pinkava, Jim Capobianco","Brad Garrett, Lou Romano, Patton Oswalt, Ian Holm, Brian Dennehy, Peter Sohn, ""Peter OToole"", Janeane Garofalo, Will Arnett, Julius Callahan, James Remar, John Ratzenberger, Teddy Newton, Tony Fucile, Jake Steinfeld, Brad Bird, Stéphane Roux, Jack Bird"
210,Ford v Ferrari,https://www.imdb.com/title/tt1950186/?ref_=chttp_t_210,James Mangold,"Jez Butterworth, John-Henry Butterworth, Jason Keller","Matt Damon, Christian Bale, Jon Bernthal, Caitríona Balfe, Josh Lucas, Noah Jupe, Tracy Letts, Remo Girone, Ray McKinnon, JJ Feild, Jack McMullen, Corrado Invernizzi, Joe Williamson, Ian Harding, Christopher Darga, Shawn Law, Emil Beheshti, Darrin Prescott"
211,The Big Lebowski,https://www.imdb.com/title/tt0118715/?ref_=chttp_t_211,"Joel Coen, Ethan Coen","Ethan Coen, Joel Coen","Jeff Bridges, John Goodman, Julianne Moore, Steve Buscemi, David Huddleston, Philip Seymour Hoffman, Tara Reid, Philip Moon, Mark Pellegrino, Peter Stormare, Flea, Torsten Voges, Jimmie Dale Gilmore, Jack Kehler, John Turturro, James G. Hoosier, Carlos Leon, Terrence Burton"
212,Tôkyô monogatari,https://www.imdb.com/title/tt0046438/?ref_=chttp_t_212,Yasujirô Ozu,"Kôgo Noda, Yasujirô Ozu","Chishû Ryû, Chieko Higashiyama, Sô Yamamura, Setsuko Hara, Haruko Sugimura, Kuniko Miyake, Kyôko Kagawa, Eijirô Tôno, Nobuo Nakamura, Shirô Ôsaka, Hisao Toake, Teruko Nagaoka, Mutsuko Sakura, Toyo Takahashi, Tôru Abe, Sachiko Mitani, Zen Murase, Mitsuhiro Môri"
213,Room,https://www.imdb.com/title/tt3170832/?ref_=chttp_t_213,Lenny Abrahamson,Emma Donoghue,"Brie Larson, Jacob Tremblay, Sean Bridgers, Wendy Crewson, Sandy McMaster, Matt Gordon, Amanda Brugel, Joe Pingue, Joan Allen, Zarrin Darnell-Martin, Cas Anvar, William H. Macy, Jee-Yun Lee, Randal Edwards, Justin Mader, Ola Sturik, Rodrigo Fernandez-Stoll, ""Rory OShea"""
214,Det sjunde inseglet,https://www.imdb.com/title/tt0050976/?ref_=chttp_t_214,Ingmar Bergman,Ingmar Bergman,"Max von Sydow, Gunnar Björnstrand, Bengt Ekerot, Nils Poppe, Bibi Andersson, Inga Gill, Maud Hansson, Inga Landgré, Gunnel Lindblom, Bertil Anderberg, Anders Ek, Åke Fridell, Gunnar Olsson, Erik Strandmark, Siv Aleros, Sten Ardenstam, Harry Asklund, Benkt-Åke Benktsson"
215,Rocky,https://www.imdb.com/title/tt0075148/?ref_=chttp_t_215,John G. Avildsen,Sylvester Stallone,"Sylvester Stallone, Talia Shire, Burt Young, Carl Weathers, Burgess Meredith, Thayer David, Joe Spinell, Jimmy Gambina, Bill Baldwin, Al Silvani, George Memmoli, Jodi Letizia, Diana Lewis, ""George OHanlon"", Larry Carroll, Stan Shaw, Don Sherman, Billy Sands"
216,Logan,https://www.imdb.com/title/tt3315342/?ref_=chttp_t_216,James Mangold,"James Mangold, Scott Frank, Michael Green","Hugh Jackman, Patrick Stewart, Dafne Keen, Boyd Holbrook, Stephen Merchant, Elizabeth Rodriguez, Richard E. Grant, Eriq La Salle, Elise Neal, Quincy Fouse, Al Coronel, Frank Gallegos, Anthony Escobar, Reynaldo Gallegos, Krzysztof Soszynski, Stephen Dunlevy, Daniel Bernhardt, Ryan Sturz"
217,Spotlight,https://www.imdb.com/title/tt1895587/?ref_=chttp_t_217,Tom McCarthy,"Josh Singer, Tom McCarthy","Mark Ruffalo, Michael Keaton, Rachel McAdams, Liev Schreiber, John Slattery, ""Brian dArcy James"", Stanley Tucci, Elena Wohl, Gene Amoroso, Doug Murray, Sharon McFarlane, Jamey Sheridan, Neal Huff, Billy Crudup, Robert B. Kennedy, Duane Murray, Brian Chamberlain, Michael Cyril Creighton"
218,Hotel Rwanda,https://www.imdb.com/title/tt0395169/?ref_=chttp_t_218,Terry George,"Keir Pearson, Terry George","Don Cheadle, Sophie Okonedo, Joaquin Phoenix, Xolani Mali, Desmond Dube, Hakeem Kae-Kazim, Tony Kgoroge, Rosie Motene, Neil McCarthy, ""Mabutho Kid Sithole"", Nick Nolte, Fana Mokoena, Jeremiah Ndlovu, Lebo Mashile, Antonio David Lyons, Leleti Khumalo, Kgomotso Seitshohlo, Lerato Mokgotho"
219,Platoon,https://www.imdb.com/title/tt0091763/?ref_=chttp_t_219,Oliver Stone,Oliver Stone,"Charlie Sheen, Tom Berenger, Willem Dafoe, Keith David, Forest Whitaker, Francesco Quinn, Kevin Dillon, John C. McGinley, Reggie Johnson, Mark Moses, Corey Glover, Johnny Depp, Chris Pedersen, Bob Orwig, Corkey Ford, David Neidorf, Richard Edson, Tony Todd"
220,The Terminator,https://www.imdb.com/title/tt0088247/?ref_=chttp_t_220,James Cameron,"James Cameron, Gale Anne Hurd, William Wisher","Arnold Schwarzenegger, Linda Hamilton, Michael Biehn, Paul Winfield, Lance Henriksen, Rick Rossovich, Bess Motta, Earl Boen, Dick Miller, Shawn Schepps, Bruce M. Kerner, Franco Columbu, Bill Paxton, Brad Rearden, Brian Thompson, William Wisher, Ken Fritz, Tom Oberhaus"
221,La passion de Jeanne d'Arc,https://www.imdb.com/title/tt0019254/?ref_=chttp_t_221,Carl Theodor Dreyer,"Joseph Delteil, Carl Theodor Dreyer","Maria Falconetti, Eugene Silvain, André Berley, Maurice Schutz, Antonin Artaud, Michel Simon, ""Jean dYd"", Louis Ravet, Armand Lurville, Jacques Arnna, Alexandre Mihalesco, Léon Larive, Jean Aymé, Camille Bardou, Gilbert Dacheux, Gilbert Dalleu, Paul Delauzac, Dimitri Dimitriev"
222,Before Sunset,https://www.imdb.com/title/tt0381681/?ref_=chttp_t_222,Richard Linklater,"Richard Linklater, Julie Delpy, Ethan Hawke","Ethan Hawke, Julie Delpy, Vernon Dobtcheff, Louise Lemoine Torrès, Rodolphe Pauly, Mariane Plasteig, Diabolo, Denis Evrard, Albert Delpy, Marie Pillet"
223,La haine,https://www.imdb.com/title/tt0113247/?ref_=chttp_t_223,Mathieu Kassovitz,Mathieu Kassovitz,"Vincent Cassel, Hubert Koundé, Saïd Taghmaoui, Abdel Ahmed Ghili, Solo, Joseph Momo, Héloïse Rauth, Rywka Wajsbrot, Olga Abrego, Laurent Labasse, Choukri Gabteni, Nabil Ben Mhamed, Benoît Magimel, Médard Niang, Arash Mansour, Abdel-Moulah Boujdouni, Mathilde Vitry, Christian Moro"
224,The Best Years of Our Lives,https://www.imdb.com/title/tt0036868/?ref_=chttp_t_224,William Wyler,"Robert E. Sherwood, MacKinlay Kantor","Myrna Loy, Dana Andrews, Fredric March, Teresa Wright, Virginia Mayo, ""Cathy ODonnell"", Hoagy Carmichael, Harold Russell, Gladys George, Roman Bohnen, Ray Collins, Minna Gombell, Walter Baldwin, Steve Cochran, Dorothy Adams, Don Beddoe, Marlene Aames, Charles Halton"
225,The Exorcist,https://www.imdb.com/title/tt0070047/?ref_=chttp_t_225,William Friedkin,William Peter Blatty,"Ellen Burstyn, Max von Sydow, Linda Blair, Lee J. Cobb, Kitty Winn, Jack MacGowran, Jason Miller, ""William OMalley"", Barton Heyman, Peter Masterson, Rudolf Schündler, Gina Petrushka, Robert Symonds, Arthur Storch, Thomas Bermingham, Vasiliki Maliaros, Titos Vandis, John Mahon"
226,Pirates of the Caribbean: The Curse of the Black Pearl,https://www.imdb.com/title/tt0325980/?ref_=chttp_t_226,Gore Verbinski,"Ted Elliott, Terry Rossio, Stuart Beattie","Johnny Depp, Geoffrey Rush, Orlando Bloom, Keira Knightley, Jack Davenport, Jonathan Pryce, Lee Arenberg, Mackenzie Crook, ""Damian OHare"", Giles New, Angus Barnett, David Bailie, Michael Berry Jr., Isaac C. Singleton Jr., Kevin McNally, Treva Etienne, Zoe Saldana, Guy Siner"
227,Rush,https://www.imdb.com/title/tt1979320/?ref_=chttp_t_227,Ron Howard,Peter Morgan,"Daniel Brühl, Chris Hemsworth, Olivia Wilde, Alexandra Maria Lara, Pierfrancesco Favino, David Calder, Natalie Dormer, Stephen Mangan, Christian McKay, Alistair Petrie, Julian Rhind-Tutt, Colin Stinton, Jamie de Courcey, Augusto Dallara, Ilario Calvo, Patrick Baladi, Vincent Riotta, Martin Savage"
228,Jai Bhim,https://www.imdb.com/title/tt15097216/?ref_=chttp_t_228,T.J. Gnanavel,"T.J. Gnanavel, Rajendra Sapre","Suriya, Lijo Mol Jose, Manikandan K., Rajisha Vijayan, Prakash Raj, Rao Ramesh, Guru Somasundaram, M.S. Bhaskar, V. Jayaprakash, Sibi Thomas, Ilavarasu, Jayarao, Sujatha Sivakumar, Ravi Venkatraman, Tamizh, Supergood Subramani, Bala Hasan, Raja Rani Pandian"
229,Network,https://www.imdb.com/title/tt0074958/?ref_=chttp_t_229,Sidney Lumet,Paddy Chayefsky,"Faye Dunaway, William Holden, Peter Finch, Robert Duvall, Wesley Addy, Ned Beatty, Arthur Burghardt, Bill Burrows, John Carpenter, Jordan Charney, Kathy Cronkite, Ed Crowley, Jerome Dempsey, Conchata Ferrell, Gene Gross, Stanley Grover, Cindy Grover, Darryl Hickman"
230,Stand by Me,https://www.imdb.com/title/tt0092005/?ref_=chttp_t_230,Rob Reiner,"Stephen King, Raynold Gideon, Bruce A. Evans","Wil Wheaton, River Phoenix, Corey Feldman, ""Jerry OConnell"", Kiefer Sutherland, Casey Siemaszko, Gary Riley, Bradley Gregg, Jason Oliver Lipsett, Marshall Bell, Frances Lee McCain, Bruce Kirby, William Bronder, Scott Beach, Richard Dreyfuss, John Cusack, Madeleine Swift, Popeye"
231,The Wizard of Oz,https://www.imdb.com/title/tt0032138/?ref_=chttp_t_231,"Victor Fleming, King Vidor","Noel Langley, Florence Ryerson, Edgar Allan Woolf","Judy Garland, Frank Morgan, Ray Bolger, Bert Lahr, Jack Haley, Billie Burke, Margaret Hamilton, Charley Grapewin, Pat Walshe, Clara Blandick, Terry, The Singer Midgets, Gladys W. Allison, John Ballas, Franz Balluck, Josefine Balluck, John T. Bambury, Dorothy Barrett"
232,The Incredibles,https://www.imdb.com/title/tt0317705/?ref_=chttp_t_232,Brad Bird,Brad Bird,"Craig T. Nelson, Samuel L. Jackson, Holly Hunter, Jason Lee, Dominique Louis, Teddy Newton, Jean Sincere, Eli Fucile, Maeve Andrews, Wallace Shawn, Spencer Fox, Lou Romano, Wayne Canney, Sarah Vowell, Michael Bird, Elizabeth Peña, Bud Luckey, Brad Bird"
233,Hachi: A Dog's Tale,https://www.imdb.com/title/tt1028532/?ref_=chttp_t_233,Lasse Hallström,"Stephen P. Lindsey, Kaneto Shindô","Richard Gere, Joan Allen, Cary-Hiroyuki Tagawa, Sarah Roemer, Jason Alexander, Erick Avari, Davenia McFadden, Robbie Sublett, Kevin DeCoste, Rob Degnan, Tora Hallström, Donna Sorbello, Frank S. Aronson, Troy Doherty, Ian Sherman, Timothy Crowe, Denece Ryland, Blake Friedman"
234,Ah-ga-ssi,https://www.imdb.com/title/tt4016934/?ref_=chttp_t_234,Park Chan-wook,"Sarah Waters, Chung Seo-kyung, Park Chan-wook","Kim Min-hee, Ha Jung-woo, Cho Jin-woong, Moon So-ri, Kim Tae-ri, Lee Yong-nyeo, Yoo Min-chae, Lee Dong-hwi, Kim Hae-sook, Lee Kyu-jung, Kim Si-eun, Ha Si-yeon, Rina Takagi, Won Geun-hee, Kim Jong-dae, Jang Han-sun, Kim Eun-yeong, Kim Ri-woo"
235,Into the Wild,https://www.imdb.com/title/tt0758758/?ref_=chttp_t_235,Sean Penn,"Sean Penn, Jon Krakauer","Emile Hirsch, Vince Vaughn, Catherine Keener, Marcia Gay Harden, William Hurt, Jena Malone, Brian H. Dierker, Kristen Stewart, Hal Holbrook, Jim Gallien, ""James ONeill"", Malinda McCollum, Paul Knauls, Zach Galifianakis, Craig Mutsch, Jim Beidler, John Decker, John Hofer"
236,Babam ve Oglum,https://www.imdb.com/title/tt0476735/?ref_=chttp_t_236,Ingmar Bergman,Ingmar Bergman,"Max von Sydow, Gunnar Björnstrand, Bengt Ekerot, Nils Poppe, Bibi Andersson, Inga Gill, Maud Hansson, Inga Landgré, Gunnel Lindblom, Bertil Anderberg, Anders Ek, Åke Fridell, Gunnar Olsson, Erik Strandmark, Siv Aleros, Sten Ardenstam, Harry Asklund, Benkt-Åke Benktsson"
237,The Sound of Music,https://www.imdb.com/title/tt0059742/?ref_=chttp_t_237,Robert Wise,"Georg Hurdalek, Howard Lindsay, Russel Crouse","Julie Andrews, Christopher Plummer, Eleanor Parker, Richard Haydn, Peggy Wood, Charmian Carr, Heather Menzies-Urich, Nicholas Hammond, Duane Chase, Angela Cartwright, Debbie Turner, Kym Karath, Anna Lee, Portia Nelson, Ben Wright, Daniel Truhitte, Norma Varden, Gilchrist Stuart"
238,The Grapes of Wrath,https://www.imdb.com/title/tt0032551/?ref_=chttp_t_238,John Ford,"Nunnally Johnson, John Steinbeck","Henry Fonda, Jane Darwell, John Carradine, Charley Grapewin, Dorris Bowdon, Russell Simpson, O.Z. Whitehead, John Qualen, Eddie Quillan, Zeffie Tilbury, Frank Sully, Frank Darien, Darryl Hickman, Shirley Mills, Roger Imhof, Grant Mitchell, Charles D. Brown, John Arledge"
239,La battaglia di Algeri,https://www.imdb.com/title/tt0058946/?ref_=chttp_t_239,Gillo Pontecorvo,"Franco Solinas, Gillo Pontecorvo","Brahim Hadjadj, Jean Martin, Yacef Saadi, Samia Kerbash, Ugo Paletti, Fouzia El Kader, Mohamed Ben Kassen, Franco Moruzzi, Tommaso Neri, Rouiched, Gene Wesson"
240,Groundhog Day,https://www.imdb.com/title/tt0107048/?ref_=chttp_t_240,Harold Ramis,"Danny Rubin, Harold Ramis","Bill Murray, Andie MacDowell, Chris Elliott, Stephen Tobolowsky, Brian Doyle-Murray, Marita Geraghty, Angela Paton, Rick Ducommun, Rick Overton, Robin Duke, Carol Bivins, Willie Garson, Ken Hudson Campbell, Les Podewell, Rod Sell, Tom Milanovich, John M. Watson Sr., Peggy Roeder"
241,To Be or Not to Be,https://www.imdb.com/title/tt0035446/?ref_=chttp_t_241,Ernst Lubitsch,"Melchior Lengyel, Edwin Justus Mayer, Ernst Lubitsch","Carole Lombard, Jack Benny, Robert Stack, Felix Bressart, Lionel Atwill, Stanley Ridges, Sig Ruman, Tom Dugan, Charles Halton, George Lynn, Henry Victor, Maude Eburne, Halliwell Hobbes, Miles Mander, Rudolph Anders, Paul Barrett, Sven Hugo Borg, Danny Borzage"
242,Amores perros,https://www.imdb.com/title/tt0245712/?ref_=chttp_t_242,Alejandro G. Iñárritu,Guillermo Arriaga,"Emilio Echevarría, Gael García Bernal, Goya Toledo, Álvaro Guerrero, Vanessa Bauche, Jorge Salinas, Marco Pérez, Rodrigo Murray, Humberto Busto, Gerardo Campbell, Rosa María Bianchi, Dunia Saldívar, Adriana Barraza, José Sefami, Lourdes Echevarría, Laura Almela, Ricardo Dalmacci, Gustavo Sánchez Parra"
243,Rebecca,https://www.imdb.com/title/tt0032976/?ref_=chttp_t_243,Alfred Hitchcock,"Daphne Du Maurier, Robert E. Sherwood, Joan Harrison","Laurence Olivier, Joan Fontaine, George Sanders, Judith Anderson, Nigel Bruce, Reginald Denny, C. Aubrey Smith, Gladys Cooper, Florence Bates, Melville Cooper, Leo G. Carroll, Leonard Carey, Lumsden Hare, Edward Fielding, Philip Winter, Forrester Harvey, Bunny Beatty, Billy Bevan"
244,Cool Hand Luke,https://www.imdb.com/title/tt0061512/?ref_=chttp_t_244,Stuart Rosenberg,"Donn Pearce, Frank Pierson, Hal Dresner","Paul Newman, George Kennedy, Strother Martin, J.D. Cannon, Lou Antonio, Robert Drivas, Jo Van Fleet, Clifton James, Morgan Woodward, Luke Askew, Marc Cavell, Richard Davalos, Robert Donner, Warren Finnerty, Dennis Hopper, John McLiam, Wayne Rogers, Harry Dean Stanton"
245,The Iron Giant,https://www.imdb.com/title/tt0129167/?ref_=chttp_t_245,Brad Bird,"Tim McCanlies, Brad Bird, Ted Hughes","Eli Marienthal, Harry Connick Jr., Jennifer Aniston, Vin Diesel, James Gammon, Cloris Leachman, Christopher McDonald, John Mahoney, M. Emmet Walsh, Jack Angel, Bob Bergen, Mary Kay Bergman, Michael Bird, Devon Cole Borisoff, Rodger Bumpass, Robert Clotworthy, Jennifer Darling, Zack Eginton"
246,The Help,https://www.imdb.com/title/tt1454029/?ref_=chttp_t_246,Tate Taylor,"Tate Taylor, Kathryn Stockett","Viola Davis, Emma Stone, Octavia Spencer, Bryce Dallas Howard, Jessica Chastain, ""Ahna OReilly"", Allison Janney, Anna Camp, Eleanor Henry, Emma Henry, Christopher Lowell, Cicely Tyson, Mike Vogel, Sissy Spacek, Brian Kerwin, Wes Chatham, Aunjanue Ellis-Taylor, Ted Welch"
247,It Happened One Night,https://www.imdb.com/title/tt0025316/?ref_=chttp_t_247,Frank Capra,"Robert Riskin, Samuel Hopkins Adams","Clark Gable, Claudette Colbert, Walter Connolly, Roscoe Karns, Jameson Thomas, Alan Hale, Arthur Hoyt, Blanche Friderici, Charles C. Wilson, Ernie Adams, Jessie Arnold, Irving Bacon, William Bailey, William Begg, William A. Boardway, Ward Bond, Harry C. Bradley, George P. Breakston"
248,Aladdin,https://www.imdb.com/title/tt0103639/?ref_=chttp_t_248,"Ron Clements, John Musker","Ron Clements, John Musker, Ted Elliott","Scott Weinger, Robin Williams, Linda Larkin, Jonathan Freeman, Frank Welker, Gilbert Gottfried, Douglas Seale, Charlie Adler, Jack Angel, Corey Burton, Philip L. Clarke, Jim Cummings, Jennifer Darling, Debi Derryberry, Bruce Gooch, Jerry Houser, Vera Lockwood, Sherry Lynn"
249,Dances with Wolves,https://www.imdb.com/title/tt0099348/?ref_=chttp_t_249,Kevin Costner,Michael Blake,"Kevin Costner, Mary McDonnell, Graham Greene, Rodney A. Grant, ""Floyd Red Crow Westerman"", Tantoo Cardinal, Robert Pastorelli, Charles Rocket, Maury Chaykin, Jimmy Herman, Nathan Lee Chasing His Horse, Michael Spears, Jason R. Lone Hill, Tony Pierce, Doris Leader Charge, Tom Everett, Larry Joshua, Kirk Baltz"
250,"Paris, Texas",https://www.imdb.com/title/tt0087884/?ref_=chttp_t_250,Wim Wenders,"L.M. Kit Carson, Sam Shepard, Walter Donohue","Harry Dean Stanton, Nastassja Kinski, Dean Stockwell, Sam Berry, Bernhard Wicki, Aurore Clément, Claresie Mobley, Hunter Carson, Viva, Socorro Valdez, Edward Fayton, Justin Hogg, Tom Farrell, John Lurie, Jeni Vici, Sally Norvell, Sharon Menzel, The Mydolls"
