Rank,English_Title,URL,Directors,Writers,Stars
1,The Shawshank Redemption,https://www.imdb.com/title/tt0111161/?ref_=chttp_t_1,Frank Darabont,"Stephen King, Frank Darabont","Tim Robbins, Morgan Freeman, Bob Gunton, William Sadler, Clancy Brown, Gil Bellows, Mark Rolston, James Whitmore, Jeffrey DeMunn, Larry Brandenburg, Neil Giuntoli, Brian Libby, David Proval, Joseph Ragno, Jude Ciccolella, Paul McCrane, Renee Blaine, Scott Mann"
2,The Godfather,https://www.imdb.com/title/tt0068646/?ref_=chttp_t_2,Francis Ford Coppola,"Mario Puzo, Francis Ford Coppola","Marlon Brando, Al Pacino, James Caan, Diane Keaton, Richard S. Castellano, Robert Duvall, Sterling Hayden, John Marley, Richard Conte, Al Lettieri, Abe Vigoda, Talia Shire, Gianni Russo, John Cazale, Rudy Bond, Al Martino, Morgana King, Lenny Montana"
3,The Dark Knight,https://www.imdb.com/title/tt0468569/?ref_=chttp_t_3,Christopher Nolan,"Jonathan Nolan, Christopher Nolan, David S. Goyer","Christian Bale, Heath Ledger, Aaron Eckhart, Michael Caine, Maggie Gyllenhaal, Gary Oldman, Morgan Freeman, Monique Gabriela Curnen, Ron Dean, Cillian Murphy, Chin Han, Nestor Carbonell, Eric Roberts, Ritchie Coster, Anthony Michael Hall, Keith Szarabajka, Colin McFarlane, Joshua Harto"
4,The Godfather Part II,https://www.imdb.com/title/tt0071562/?ref_=chttp_t_4,Francis Ford Coppola,"Francis Ford Coppola, Mario Puzo","Al Pacino, Robert De Niro, Robert Duvall, Diane Keaton, John Cazale, Talia Shire, Lee Strasberg, Michael V. Gazzo, G.D. Spradlin, Richard Bright, Gastone Moschin, Tom Rosqui, Bruno Kirby, Frank Sivero, Francesca De Sapio, Morgana King, Marianna Hill, Leopoldo Trieste"
5,12 Angry Men,https://www.imdb.com/title/tt0050083/?ref_=chttp_t_5,Sidney Lumet,Reginald Rose,"Henry Fonda, Lee J. Cobb, Martin Balsam, John Fiedler, E.G. Marshall, Jack Klugman, Edward Binns, Jack Warden, Joseph Sweeney, Ed Begley, George Voskovec, Robert Webber, Rudy Bond, Tom Gorman, James Kelly, Billy Nelson, John Savoca, Walter Stocker"
6,Schindler's List,https://www.imdb.com/title/tt0108052/?ref_=chttp_t_6,Steven Spielberg,"Thomas Keneally, Steven Zaillian","Liam Neeson, Ralph Fiennes, Ben Kingsley, Caroline Goodall, Jonathan Sagall, Embeth Davidtz, Malgorzata Gebel, Shmuel Levy, Mark Ivanir, Béatrice Macola, Andrzej Seweryn, Friedrich von Thun, Krzysztof Luft, Harry Nehring, Norbert Weisser, Adi Nitzan, Michael Schneider, Miri Fabian"
7,The Lord of the Rings: The Return of the King,https://www.imdb.com/title/tt0167260/?ref_=chttp_t_7,Peter Jackson,"J.R.R. Tolkien, Fran Walsh, Philippa Boyens","Elijah Wood, Viggo Mortensen, Ian McKellen, Orlando Bloom, Noel Appleby, Ali Astin, Sean Astin, David Aston, John Bach, Sean Bean, Cate Blanchett, Billy Boyd, Sadwyn Brophy, Alistair Browning, Marton Csokas, Richard Edge, Jason Fitch, Bernard Hill"
8,Pulp Fiction,https://www.imdb.com/title/tt0110912/?ref_=chttp_t_8,Quentin Tarantino,"Quentin Tarantino, Roger Avary","John Travolta, Uma Thurman, Samuel L. Jackson, Bruce Willis, Tim Roth, Amanda Plummer, Laura Lovelace, Phil LaMarr, Frank Whaley, Burr Steers, Ving Rhames, Paul Calderon, Bronagh Gallagher, Rosanna Arquette, Eric Stoltz, Jerome Patrick Hoban, Michael Gilden, Gary Shorelle"
9,The Lord of the Rings: The Fellowship of the Ring,https://www.imdb.com/title/tt0120737/?ref_=chttp_t_9,Peter Jackson,"J.R.R. Tolkien, Fran Walsh, Philippa Boyens","Elijah Wood, Ian McKellen, Orlando Bloom, Sean Bean, Alan Howard, Noel Appleby, Sean Astin, Sala Baker, Billy Boyd, Andy Serkis, Marton Csokas, Viggo Mortensen, Megan Edwards, Michael Elsworth, Cate Blanchett, Mark Ferguson, Ian Holm, Christopher Lee"
10,"Il buono, il brutto, il cattivo",https://www.imdb.com/title/tt0060196/?ref_=chttp_t_10,Sergio Leone,"Luciano Vincenzoni, Sergio Leone, Agenore Incrocci","Clint Eastwood, Eli Wallach, Lee Van Cleef, Aldo Giuffrè, Luigi Pistilli, Rada Rassimov, Enzo Petito, Claudio Scarchilli, John Bartha, Livio Lorenzon, Antonio Casale, Sandro Scarchilli, Benito Stefanelli, Angelo Novi, Antonio Casas, Aldo Sambrell, Al Mulock, Sergio Mendizábal"
11,Forrest Gump,https://www.imdb.com/title/tt0109830/?ref_=chttp_t_11,Robert Zemeckis,"Winston Groom, Eric Roth","Tom Hanks, Robin Wright, Gary Sinise, Sally Field, Rebecca Williams, Michael Conner Humphreys, Harold G. Herthum, George Kelly, Bob Penny, John Randall, Sam Anderson, Margo Moorer, Ione M. Telech, Christine Seabrook, John Worsham, Peter Dobson, Siobhan Fallon Hogan, Alexander Zemeckis"
12,The Lord of the Rings: The Two Towers,https://www.imdb.com/title/tt0167261/?ref_=chttp_t_12,Peter Jackson,"J.R.R. Tolkien, Fran Walsh, Philippa Boyens","Elijah Wood, Ian McKellen, Viggo Mortensen, Orlando Bloom, Bruce Allpress, Sean Astin, John Bach, Sala Baker, Cate Blanchett, Billy Boyd, Jed Brophy, Sam Comery, Brad Dourif, Calum Gittins, Bernard Hill, Bruce Hopkins, Paris Howe Strewe, Christopher Lee"
13,Fight Club,https://www.imdb.com/title/tt0137523/?ref_=chttp_t_13,David Fincher,"Chuck Palahniuk, Jim Uhls","Brad Pitt, Edward Norton, Meat Loaf, Zach Grenier, Richmond Arquette, David Andrews, George Maguire, Eugenie Bondurant, Christina Cabot, Helena Bonham Carter, ""Sydney Big Dawg Colston"", Rachel Singer, Christie Cronenweth, Tim DeZarn, Ezra Buzzington, Dierdre Downing-Jackson, Bob Stephenson, Charlie Dell"
14,Inception,https://www.imdb.com/title/tt1375666/?ref_=chttp_t_14,Christopher Nolan,Christopher Nolan,"Leonardo DiCaprio, Joseph Gordon-Levitt, Elliot Page, Ken Watanabe, Tom Hardy, Dileep Rao, Cillian Murphy, Tom Berenger, Marion Cotillard, Pete Postlethwaite, Michael Caine, Lukas Haas, Tai-Li Lee, Claire Geare, Magnus Nolan, Taylor Geare, Johnathan Geare, Tohoru Masamune"
15,Dune: Part Two,https://www.imdb.com/title/tt15239678/?ref_=chttp_t_15,Denis Villeneuve,"Denis Villeneuve, Jon Spaihts, Frank Herbert","Timothée Chalamet, Zendaya, Rebecca Ferguson, Javier Bardem, Josh Brolin, Austin Butler, Florence Pugh, Dave Bautista, Christopher Walken, Léa Seydoux, Stellan Skarsgård, Charlotte Rampling, Souheila Yacoub, Roger Yuan, Babs Olusanmokun, Alison Halstead, Giusi Merli, Kait Tenison"
16,Star Wars: Episode V - The Empire Strikes Back,https://www.imdb.com/title/tt0080684/?ref_=chttp_t_16,Irvin Kershner,"Leigh Brackett, Lawrence Kasdan, George Lucas","Mark Hamill, Harrison Ford, Carrie Fisher, Billy Dee Williams, Anthony Daniels, David Prowse, Peter Mayhew, Kenny Baker, Frank Oz, Alec Guinness, Jeremy Bulloch, John Hollis, Jack Purvis, Des Webb, Clive Revill, Kenneth Colley, Julian Glover, Michael Sheard"
17,The Matrix,https://www.imdb.com/title/tt0133093/?ref_=chttp_t_17,"Lana Wachowski, Lilly Wachowski","Lilly Wachowski, Lana Wachowski","Keanu Reeves, Laurence Fishburne, Carrie-Anne Moss, Hugo Weaving, Gloria Foster, Joe Pantoliano, Marcus Chong, Julian Arahanga, Matt Doran, Belinda McClory, Anthony Ray Parker, Paul Goddard, Robert Taylor, David Aston, Marc Aden Gray, Ada Nicodemou, Deni Gordon, Rowan Witt"
18,Goodfellas,https://www.imdb.com/title/tt0099685/?ref_=chttp_t_18,Martin Scorsese,"Nicholas Pileggi, Martin Scorsese","Robert De Niro, Ray Liotta, Joe Pesci, Lorraine Bracco, Paul Sorvino, Frank Sivero, Tony Darrow, Mike Starr, Frank Vincent, Chuck Low, Frank DiLeo, Henny Youngman, Gina Mastrogiacomo, Catherine Scorsese, Charles Scorsese, Suzanne Shepherd, Debi Mazar, Margo Winkler"
19,One Flew Over the Cuckoo's Nest,https://www.imdb.com/title/tt0073486/?ref_=chttp_t_19,Milos Forman,"Lawrence Hauben, Bo Goldman, Ken Kesey","Jack Nicholson, Louise Fletcher, Michael Berryman, Peter Brocco, Dean R. Brooks, Alonzo Brown, Scatman Crothers, Mwako Cumbuka, Danny DeVito, William Duell, Josip Elic, Lan Fendors, Nathan George, Ken Kenny, Mel Lambert, Sydney Lassick, Kay Lee, Christopher Lloyd"
20,Se7en,https://www.imdb.com/title/tt0114369/?ref_=chttp_t_20,David Fincher,Andrew Kevin Walker,"Morgan Freeman, Brad Pitt, Kevin Spacey, Andrew Kevin Walker, Daniel Zacapa, Gwyneth Paltrow, John Cassini, Bob Mack, Peter Crombie, Reg E. Cathey, R. Lee Ermey, George Christy, Endre Hules, Hawthorne James, William Davidson, Bob Collins, Jimmy Dale Hartsell, Richard Roundtree"
21,Interstellar,https://www.imdb.com/title/tt0816692/?ref_=chttp_t_21,Christopher Nolan,"Jonathan Nolan, Christopher Nolan","Matthew McConaughey, Anne Hathaway, Jessica Chastain, Mackenzie Foy, Ellen Burstyn, John Lithgow, Timothée Chalamet, David Oyelowo, Collette Wolfe, Francis X. McCarthy, Bill Irwin, Andrew Borba, Wes Bentley, William Devane, Michael Caine, David Gyasi, Josh Stewart, Casey Affleck"
22,It's a Wonderful Life,https://www.imdb.com/title/tt0038650/?ref_=chttp_t_22,Frank Capra,"Frances Goodrich, Albert Hackett, Frank Capra","James Stewart, Donna Reed, Lionel Barrymore, Thomas Mitchell, Henry Travers, Beulah Bondi, Frank Faylen, Ward Bond, Gloria Grahame, H.B. Warner, Frank Albertson, Todd Karns, Samuel S. Hinds, Mary Treen, Virginia Patton, Charles Williams, Sarah Edwards, William Edmunds"
23,Shichinin no samurai,https://www.imdb.com/title/tt0047478/?ref_=chttp_t_23,Akira Kurosawa,"Akira Kurosawa, Shinobu Hashimoto, Hideo Oguni","Toshirô Mifune, Takashi Shimura, Keiko Tsushima, Yukiko Shimazaki, Kamatari Fujiwara, Daisuke Katô, Isao Kimura, Minoru Chiaki, Seiji Miyaguchi, Yoshio Kosugi, Bokuzen Hidari, Yoshio Inaba, Yoshio Tsuchiya, Kokuten Kôdô, Eijirô Tôno, Kichijirô Ueda, Jun Tatara, Atsushi Watanabe"
24,The Silence of the Lambs,https://www.imdb.com/title/tt0102926/?ref_=chttp_t_24,Jonathan Demme,"Thomas Harris, Ted Tally","Jodie Foster, Anthony Hopkins, Scott Glenn, Ted Levine, Anthony Heald, Brooke Smith, Diane Baker, Kasi Lemmons, Charles Napier, Tracey Walter, Roger Corman, Ron Vawter, Danny Darst, Jeffrie Lane, Frankie Faison, Paul Lazar, Dan Butler, Chris Isaak"
25,Saving Private Ryan,https://www.imdb.com/title/tt0120815/?ref_=chttp_t_25,Steven Spielberg,Robert Rodat,"Tom Hanks, Matt Damon, Tom Sizemore, Edward Burns, Barry Pepper, Adam Goldberg, Vin Diesel, Giovanni Ribisi, Jeremy Davies, Ted Danson, Paul Giamatti, Dennis Farina, Joerg Stadler, Max Martini, Dylan Bruno, Daniel Cerqueira, Demetri Goritsas, Ian Porter"
26,Cidade de Deus,https://www.imdb.com/title/tt0317248/?ref_=chttp_t_26,"Fernando Meirelles, Kátia Lund","Paulo Lins, Bráulio Mantovani","Alexandre Rodrigues, Leandro Firmino, Matheus Nachtergaele, Phellipe Haagensen, Douglas Silva, Jonathan Haagensen, Seu Jorge, Jefechander Suplino, Alice Braga, Emerson Gomes, Edson Oliveira, Michel Gomes, Roberta Rodrigues, Luis Otávio, Kiko Marques, Gustavo Engrácia, Darlan Cunha, Robson Rocha"
27,La vita è bella,https://www.imdb.com/title/tt0118799/?ref_=chttp_t_27,Roberto Benigni,"Vincenzo Cerami, Roberto Benigni","Roberto Benigni, Nicoletta Braschi, Giorgio Cantarini, Giustino Durano, Sergio Bini Bustric, Marisa Paredes, Horst Buchholz, Lidia Alfonsi, Giuliana Lojodice, Amerigo Fontani, Pietro De Silva, Francesco Guzzo, Raffaella Lebboroni, Claudio Alfonsi, Gil Baroni, Massimo Bianchi, Jürgen Bohn, Verena Buratti"
28,The Green Mile,https://www.imdb.com/title/tt0120689/?ref_=chttp_t_28,Frank Darabont,"Stephen King, Frank Darabont","Tom Hanks, Michael Clarke Duncan, David Morse, Bonnie Hunt, James Cromwell, Michael Jeter, Graham Greene, Doug Hutchison, Sam Rockwell, Barry Pepper, Jeffrey DeMunn, Patricia Clarkson, Harry Dean Stanton, Dabbs Greer, Eve Brent, William Sadler, Mack Miles, Rai Tasco"
29,Terminator 2: Judgment Day,https://www.imdb.com/title/tt0103064/?ref_=chttp_t_29,James Cameron,"James Cameron, William Wisher","Arnold Schwarzenegger, Linda Hamilton, Edward Furlong, Robert Patrick, Earl Boen, Joe Morton, S. Epatha Merkerson, Castulo Guerra, Danny Cooksey, Jenette Goldstein, Xander Berkeley, Leslie Hamilton Gearren, Ken Gibbel, Robert Winley, Pete Schrum, Shane Wilder, Michael Edwards, Jared Lounsbery"
30,Star Wars,https://www.imdb.com/title/tt0076759/?ref_=chttp_t_30,George Lucas,George Lucas,"Mark Hamill, Harrison Ford, Carrie Fisher, Alec Guinness, Peter Cushing, Anthony Daniels, Kenny Baker, Peter Mayhew, David Prowse, Phil Brown, Shelagh Fraser, Jack Purvis, Alex McCrindle, Eddie Byrne, Drewe Henley, Denis Lawson, Garrick Hagon, Jack Klaff"
31,Back to the Future,https://www.imdb.com/title/tt0088763/?ref_=chttp_t_31,Robert Zemeckis,"Robert Zemeckis, Bob Gale","Michael J. Fox, Christopher Lloyd, Lea Thompson, Crispin Glover, Tom Wilson, Claudia Wells, Marc McClure, Wendie Jo Sperber, George DiCenzo, Frances Lee McCain, James Tolkan, J.J. Cohen, Casey Siemaszko, Billy Zane, Harry Waters Jr., Donald Fullilove, Lisa Freeman, Cristen Kauffman"
32,Sen to Chihiro no kamikakushi,https://www.imdb.com/title/tt0245429/?ref_=chttp_t_32,Hayao Miyazaki,Hayao Miyazaki,"Daveigh Chase, Suzanne Pleshette, Miyu Irino, Rumi Hiiragi, Mari Natsuki, Takashi Naitô, Yasuko Sawaguchi, Tatsuya Gashûin, Ryunosuke Kamiki, Yumi Tamai, Yô Ôizumi, Koba Hayashi, Tsunehiko Kamijô, Takehiko Ono, Bunta Sugawara, Shigeru Wakita, Shirô Saitô, Michiko Yamamoto"
33,The Pianist,https://www.imdb.com/title/tt0253474/?ref_=chttp_t_33,Roman Polanski,"Ronald Harwood, Wladyslaw Szpilman","Adrien Brody, Thomas Kretschmann, Frank Finlay, Emilia Fox, Michal Zebrowski, Ed Stoppard, Maureen Lipman, Jessica Kate Meyer, Julia Rayner, Wanja Mues, Richard Ridings, Nomi Sharron, Anthony Milner, Lucy Skeaping, Roddy Skeaping, Ben Harlan, Thomas Lawinky, Joachim Paul Assböck"
34,Gisaengchung,https://www.imdb.com/title/tt6751668/?ref_=chttp_t_34,Bong Joon Ho,"Bong Joon Ho, Han Jin-won","Song Kang-ho, Lee Sun-kyun, Cho Yeo-jeong, Choi Woo-sik, Park So-dam, Lee Jeong-eun, Jang Hye-jin, Park Myeong-hoon, Jung Ji-so, Jung Hyun-jun, Park Keun-rok, Jung Yi-seo, Jo Jae-myeong, Jung Ik-han, Kim Kyu-baek, Hwang In-kyung, Ahn Seong-bong, Kim Jin-hyung"
35,Psycho,https://www.imdb.com/title/tt0054215/?ref_=chttp_t_35,Alfred Hitchcock,"Joseph Stefano, Robert Bloch","Anthony Perkins, Janet Leigh, Vera Miles, John Gavin, Martin Balsam, John McIntire, Simon Oakland, Frank Albertson, Patricia Hitchcock, Vaughn Taylor, Lurene Tuttle, John Anderson, Mort Mills, Fletcher Allen, Walter Bacon, Prudence Beers, Kit Carson, Francis De Sales"
36,Spider-Man: Across the Spider-Verse,https://www.imdb.com/title/tt9362722/?ref_=chttp_t_36,"Joaquim Dos Santos, Kemp Powers, Justin K. Thompson","Phil Lord, Christopher Miller, Dave Callaham","Shameik Moore, Hailee Steinfeld, Brian Tyree Henry, Luna Lauren Velez, Jake Johnson, Oscar Isaac, Jason Schwartzman, Issa Rae, Daniel Kaluuya, Karan Soni, Shea Whigham, Greta Lee, Mahershala Ali, Amandla Stenberg, Jharrel Jerome, Andy Samberg, Jack Quaid, Rachel Dratch"
37,Gladiator,https://www.imdb.com/title/tt0172495/?ref_=chttp_t_37,Ridley Scott,"David Franzoni, John Logan, William Nicholson","Russell Crowe, Joaquin Phoenix, Connie Nielsen, Oliver Reed, Richard Harris, Derek Jacobi, Djimon Hounsou, David Schofield, John Shrapnel, Tomas Arana, Ralf Moeller, Spencer Treat Clark, David Hemmings, Tommy Flanagan, Sven-Ole Thorsen, Omid Djalili, Nicholas McGaughey, Chris Kell"
38,The Lion King,https://www.imdb.com/title/tt0110357/?ref_=chttp_t_38,"Roger Allers, Rob Minkoff","Irene Mecchi, Jonathan Roberts, Linda Woolverton","Matthew Broderick, Jeremy Irons, James Earl Jones, Whoopi Goldberg, Rowan Atkinson, Niketa Calame-Harris, Jim Cummings, Robert Guillaume, Moira Kelly, Nathan Lane, Zoe Leader, Cheech Marin, Ernie Sabella, Madge Sinclair, Jonathan Taylor Thomas, Frank Welker, Cathy Cavadini, Judi M. Durand"
39,Léon,https://www.imdb.com/title/tt0110413/?ref_=chttp_t_39,Luc Besson,Luc Besson,"Jean Reno, Gary Oldman, Natalie Portman, Danny Aiello, Peter Appel, Willi One Blood, Don Creech, Keith A. Glascoe, Randolph Scott, Michael Badalucco, Ellen Greene, Elizabeth Regen, Carl J. Matusovich, Frank Senger, Lucius Wyatt Cherokee, Eric Challier, Luc Bernard, Maïwenn"
40,The Departed,https://www.imdb.com/title/tt0407887/?ref_=chttp_t_40,Martin Scorsese,"William Monahan, Alan Mak, Felix Chong","Leonardo DiCaprio, Matt Damon, Jack Nicholson, Mark Wahlberg, Martin Sheen, Ray Winstone, Vera Farmiga, Anthony Anderson, Alec Baldwin, Kevin Corrigan, James Badge Dale, ""David OHara"", Mark Rolston, Robert Wahlberg, Kristen Dalton, Thomas B. Duffy, Richard Hughes, J.C. MacKenzie"
41,American History X,https://www.imdb.com/title/tt0120586/?ref_=chttp_t_41,Tony Kaye,David McKenna,"Edward Norton, Edward Furlong, ""Beverly DAngelo"", Jennifer Lien, Ethan Suplee, Fairuza Balk, Avery Brooks, Elliott Gould, Stacy Keach, William Russ, Guy Torry, Joe Cortese, Jason Bose Smith, Antonio David Lyons, Alex Sol, Keram Malicki-Sánchez, Giuseppe Andrews, Michelle Christine White"
42,Whiplash,https://www.imdb.com/title/tt2582802/?ref_=chttp_t_42,Damien Chazelle,Damien Chazelle,"Miles Teller, J.K. Simmons, Melissa Benoist, Paul Reiser, Austin Stowell, Nate Lang, Chris Mulkey, Damon Gupton, Suanne Spoke, Max Kasch, Charlie Ian, Jayson Blair, Kofi Siriboe, Kavita Patil, C.J. Vana, Tarik Lowe, Tyler Kimball, Rogelio Douglas Jr."
43,The Prestige,https://www.imdb.com/title/tt0482571/?ref_=chttp_t_43,Christopher Nolan,"Jonathan Nolan, Christopher Nolan, Christopher Priest","Christian Bale, Hugh Jackman, Scarlett Johansson, Michael Caine, Piper Perabo, Rebecca Hall, Samantha Mahurin, David Bowie, Andy Serkis, Daniel Davis, Jim Piddock, Christopher Neame, Mark Ryan, Roger Rees, Jamie Harris, Monty Stuart, Ron Perkins, Ricky Jay"
44,Hotaru no haka,https://www.imdb.com/title/tt0095327/?ref_=chttp_t_44,Isao Takahata,"Akiyuki Nosaka, Isao Takahata","Tsutomu Tatsumi, Ayano Shiraishi, Akemi Yamaguchi, Yoshiko Shinohara, Kôzô Hashida, Masayo Sakai, Kazumi Nozaki, Yoshio Matsuoka, Masahiro Kanetake, Kiyoshi Yanagawa, Hajime Maki, Atsuo Omote, Teruhisa Harita, Hiroshi Tanaka, Michio Denpô, Shirô Tamaki, Tadashi Nakamura, Mika Sekita"
45,Seppuku,https://www.imdb.com/title/tt0056058/?ref_=chttp_t_45,Masaki Kobayashi,"Yasuhiko Takiguchi, Shinobu Hashimoto","Tatsuya Nakadai, Akira Ishihama, Shima Iwashita, Tetsurô Tanba, Masao Mishima, Ichirô Nakatani, Kei Satô, Yoshio Inaba, Hisashi Igawa, Tôru Takeuchi, Yoshirô Aoki, Tatsuo Matsumura, Akiji Kobayashi, Kôichi Hayashi, Ryûtarô Gomi, Jô Azumi, Nakajirô Tomita, Shichisaburô Amatsu"
46,The Usual Suspects,https://www.imdb.com/title/tt0114814/?ref_=chttp_t_46,Bryan Singer,Christopher McQuarrie,"Kevin Spacey, Gabriel Byrne, Chazz Palminteri, Stephen Baldwin, Benicio Del Toro, Kevin Pollak, Pete Postlethwaite, Suzy Amis, Giancarlo Esposito, Dan Hedaya, Paul Bartel, Carl Bressler, Phillipe Simon, Jack Shearer, Christine Estabrook, Clark Gregg, Morgan Hunter, Ken Daly"
47,Casablanca,https://www.imdb.com/title/tt0034583/?ref_=chttp_t_47,Michael Curtiz,"Julius J. Epstein, Philip G. Epstein, Howard Koch","Humphrey Bogart, Ingrid Bergman, Paul Henreid, Claude Rains, Conrad Veidt, Sydney Greenstreet, Peter Lorre, S.Z. Sakall, Madeleine Lebeau, Dooley Wilson, Joy Page, John Qualen, Leonid Kinskey, Curt Bois, Abdullah Abbas, Enrique Acosta, Ed Agresti, Arnet Amos"
48,Intouchables,https://www.imdb.com/title/tt1675434/?ref_=chttp_t_48,"Olivier Nakache, Éric Toledano","Olivier Nakache, Éric Toledano, Philippe Pozzo di Borgo","François Cluzet, Omar Sy, Anne Le Ny, Audrey Fleurot, Joséphine de Meaux, Clotilde Mollet, Alba Gaïa Bellugi, Cyril Mendy, Salimata Kamate, Absa Diatou Toure, Grégoire Oestermann, Dominique Daguier, François Caron, Christian Ameri, Thomas Solivérès, Dorothée Brière, Marie-Laure Descoureaux, Émilie Caen"
49,Nuovo Cinema Paradiso,https://www.imdb.com/title/tt0095765/?ref_=chttp_t_49,Giuseppe Tornatore,"Giuseppe Tornatore, Vanna Paoli","Philippe Noiret, Enzo Cannavale, Antonella Attili, Isa Danieli, Leo Gullotta, Marco Leonardi, Pupella Maggio, Agnese Nano, Leopoldo Trieste, Salvatore Cascio, Tano Cimarosa, Nicola Di Pinto, Roberta Lena, Nino Terzo, Jacques Perrin, Nellina Laganà, Turi Giuffrida, Mariella Lo Giudice"
50,Modern Times,https://www.imdb.com/title/tt0027977/?ref_=chttp_t_50,Charles Chaplin,Charles Chaplin,"Charles Chaplin, Paulette Goddard, Henry Bergman, Tiny Sandford, Chester Conklin, Hank Mann, Stanley Blystone, Al Ernest Garcia, Richard Alexander, Cecil Reynolds, Mira McKinney, Murdock MacQuarrie, Wilfred Lucas, Edward LeSaint, Fred Malatesta, Sammy Stein, Juana Sutton, Ted Oliver"
51,Rear Window,https://www.imdb.com/title/tt0047396/?ref_=chttp_t_51,Alfred Hitchcock,"John Michael Hayes, Cornell Woolrich","James Stewart, Grace Kelly, Wendell Corey, Thelma Ritter, Raymond Burr, Judith Evelyn, Ross Bagdasarian, Georgine Darcy, Sara Berner, Frank Cady, Jesslyn Fax, Rand Harper, Irene Winston, Havis Davenport, Jerry Antes, Barbara Bailey, Benny Bartlett, Nick Borgani"
52,C'era una volta il West,https://www.imdb.com/title/tt0064116/?ref_=chttp_t_52,Sergio Leone,"Sergio Donati, Sergio Leone, Dario Argento","Henry Fonda, Charles Bronson, Claudia Cardinale, Jason Robards, Gabriele Ferzetti, Paolo Stoppa, Woody Strode, Jack Elam, Keenan Wynn, Frank Wolff, Lionel Stander, Livio Andronico, Salvatore Basile, Aldo Berti, Joseph Bradley, Frank Braña, Marilù Carteny, Saturno Cerra"
53,Alien,https://www.imdb.com/title/tt0078748/?ref_=chttp_t_53,Ridley Scott,"""Dan OBannon"", Ronald Shusett","Sigourney Weaver, Tom Skerritt, John Hurt, Veronica Cartwright, Harry Dean Stanton, Ian Holm, Yaphet Kotto, Bolaji Badejo, Helen Horton, Eddie Powell"
54,City Lights,https://www.imdb.com/title/tt0021749/?ref_=chttp_t_54,Charles Chaplin,"Charles Chaplin, Harry Carr, Harry Crocker","Charles Chaplin, Virginia Cherrill, Florence Lee, Harry Myers, Al Ernest Garcia, Hank Mann, Johnny Aber, Jack Alexander, T.S. Alexander, Victor Alexander, Albert Austin, Harry Ayers, Eddie Baker, Henry Bergman, Edward Biby, Betty Blair, Buster Brodie, Jeanne Carpenter"
55,Apocalypse Now,https://www.imdb.com/title/tt0078788/?ref_=chttp_t_55,Francis Ford Coppola,"John Milius, Francis Ford Coppola, Michael Herr","Martin Sheen, Marlon Brando, Robert Duvall, Frederic Forrest, Sam Bottoms, Laurence Fishburne, Albert Hall, Harrison Ford, Dennis Hopper, G.D. Spradlin, Jerry Ziesmer, Scott Glenn, Bo Byers, James Keane, Kerry Rossall, Ron McQueen, Tom Mason, Cynthia Wood"
56,Django Unchained,https://www.imdb.com/title/tt1853728/?ref_=chttp_t_56,Quentin Tarantino,Quentin Tarantino,"Jamie Foxx, Christoph Waltz, Leonardo DiCaprio, Kerry Washington, Samuel L. Jackson, Walton Goggins, Dennis Christopher, James Remar, David Steen, Dana Gourrier, Nichole Galicia, Laura Cayouette, Ato Essandoh, Sammi Rotibi, Clay Donahue Fontenot, Escalante Lundy, Miriam F. Glover, Don Johnson"
57,Memento,https://www.imdb.com/title/tt0209144/?ref_=chttp_t_57,Christopher Nolan,"Christopher Nolan, Jonathan Nolan","Guy Pearce, Carrie-Anne Moss, Joe Pantoliano, Mark Boone Junior, Russ Fega, Jorja Fox, Stephen Tobolowsky, Harriet Sansom Harris, Thomas Lennon, Callum Keith Rennie, Kimberly Campbell, Marianne Muellerleile, Larry Holden, Doshia Darmane, Stephanie Searson, Buzz Visconti"
58,12th Fail,https://www.imdb.com/title/tt23849204/?ref_=chttp_t_58,Vidhu Vinod Chopra,"Vidhu Vinod Chopra, Jaskunwar Kohli, Anurag Pathak","Vikrant Massey, Medha Shankr, Anant Joshi, Anshuman Pushkar, Geeta Agrawal Sharma, Harish Khanna, Sarita Joshi, Priyanshu Chatterjee, Vikas Divyakirti, Abhishek Sengupta, Triaksh Chhabra, Darius Chinoy, Vijay Kumar Dogra, Fasi Khan, Sam Mohan, Rahul Dev Shetty, Suraj Naagar, Sanjay Bishnoi"
59,WALL·E,https://www.imdb.com/title/tt0910970/?ref_=chttp_t_59,Andrew Stanton,"Andrew Stanton, Pete Docter, Jim Reardon","Ben Burtt, Elissa Knight, Jeff Garlin, Fred Willard, MacInTalk, John Ratzenberger, Kathy Najimy, Sigourney Weaver, Karleen Griffin, Kim Kopf, Niki McElroy, Garrett Palmer, Jessica Skelton, Kai Steel Smith, Michael Toy"
60,Raiders of the Lost Ark,https://www.imdb.com/title/tt0082971/?ref_=chttp_t_60,Steven Spielberg,"Lawrence Kasdan, George Lucas, Philip Kaufman","Harrison Ford, Karen Allen, Paul Freeman, John Rhys-Davies, Ronald Lacey, Denholm Elliott, Alfred Molina, Wolf Kahler, Anthony Higgins, Vic Tablian, Don Fellows, William Hootkins, Bill Reimbold, Fred Sorenson, Patrick Durkin, Matthew Scurfield, Malcolm Weaver, Sonny Caldinez"
61,Das Leben der Anderen,https://www.imdb.com/title/tt0405094/?ref_=chttp_t_61,Florian Henckel von Donnersmarck,Florian Henckel von Donnersmarck,"Ulrich Mühe, Martina Gedeck, Sebastian Koch, Ulrich Tukur, Thomas Thieme, Hans-Uwe Bauer, Volkmar Kleinert, Matthias Brenner, Charly Hübner, Herbert Knaup, Bastian Trost, Marie Gruber, Volker Zack, Werner Daehn, Martin Brambach, Hubertus Hartmann, Thomas Arnold, Hinnerk Schönemann"
62,Sunset Boulevard,https://www.imdb.com/title/tt0043014/?ref_=chttp_t_62,Billy Wilder,"Charles Brackett, Billy Wilder, D.M. Marshman Jr.","William Holden, Gloria Swanson, Erich von Stroheim, Nancy Olson, Fred Clark, Lloyd Gough, Jack Webb, Franklyn Farnum, Larry J. Blake, Charles Dayton, Cecil B. DeMille, Hedda Hopper, Buster Keaton, Anna Q. Nilsson, H.B. Warner, Ray Evans, Jay Livingston, Fred Aldrich"
63,Paths of Glory,https://www.imdb.com/title/tt0050825/?ref_=chttp_t_63,Stanley Kubrick,"Stanley Kubrick, Calder Willingham, Jim Thompson","Kirk Douglas, Ralph Meeker, Adolphe Menjou, George Macready, Wayne Morris, Richard Anderson, Joe Turkel, Christiane Kubrick, Jerry Hausner, Peter Capell, Emile Meyer, Bert Freed, Kem Dibbs, Timothy Carey, Fred Bell, John Stein, Harold Benedict, Leon Briggs"
64,Avengers: Infinity War,https://www.imdb.com/title/tt4154756/?ref_=chttp_t_64,"Anthony Russo, Joe Russo","Christopher Markus, Stephen McFeely, Stan Lee","Robert Downey Jr., Chris Hemsworth, Mark Ruffalo, Chris Evans, Scarlett Johansson, Don Cheadle, Benedict Cumberbatch, Tom Holland, Chadwick Boseman, Zoe Saldana, Karen Gillan, Tom Hiddleston, Paul Bettany, Elizabeth Olsen, Anthony Mackie, Sebastian Stan, Idris Elba, Danai Gurira"
